Event id,Opened date,CAUSAL_VERBATIM,CORRECTION_VERBATIM,CUSTOMER_VERBATIM,BUILD_DATE,BUILD_PLANT_DESC,CAUSAL_CD_DESC,COMPLAINT_CD_DESC,IN_USE_DATE,MAKE,MODEL,MODLYR,PLANT,Trigger,Failure Component,Failure Condition,Additional Context,Fix Component,Fix Condition,Combined_Text,Extracted_Component
D-14801,9/17/2019,unable to duplicate the concern at this time radio and display both working normally and no current dtcs set found multiple historydtcs set with   appearing in the TCICM and amplifier but nothing failed at this time no bulletins found for this concernrequires more time to inspect further attempted to check for possible radio software updates as per shop managers request but SPSerror code   stop appears before programming screen is reached and unable to check for updated software no OTA softwareavailable at the time of inspection called Techline support for assistance and Daniel retrieved the radio module identifier numbersfor engineering unable to program the radio at this time as per Techline support case #  waiting for engineering responseadvise radio and display working normally during inspection never cut out even once radio cut out as described by the customerwhile checking for programming updates the second time dtc   reset current in the TCICM and amplifier and then went to historystatus when the radio came back on and reset to the factory agreements screen requires further diagnosis of the ethernet data linesat the radio diagnostics lead to radio replacement requires new radio module,"waiting for techline engineering response, attempted to reprogram the radio after engineering resolved the programming errorconcern but found no new updated software available through SPS programming (SPS warranty code  ) and USB programming isnot supported for this device at this time, unable to reprogram the radio at this time but while checking   data for any newconcerns the audio and control buttons/knobs quit working and then the screen went black and the radio reset to factory agreementsscreen, dtc   set current in the TCICM and the amplifier before changing to history status when the radio came back on,followed the flow chart for the dtc (document # ) and tested circuits at the radio, all circuits and pin grips good, ethernetmalfunction internal to the radio assembly requires radio replacement, replaced the radio with new and programmed as needed, SPSprogramming only no OTA or USB programming available at this time, warranty claim code  , reset the system as requiredafter programming and tested operation, all good, completed",Customer reports that radio and screen is intermittantly inop Inspect and advise,2019-08-14T00:00:00.000Z,Flint,Module/Component-No/Incorrect Communication,Audio/Entertainment/Navigation - Other issues,2019-09-10T00:00:00.000Z,NovaSprint,AeroSpecter,2020,FLT,['No Additional Functionality'],"['Audio Unit', 'Display']","['Controls Irresponsive', 'Black Screen']",['No Additional Context'],"['Radio', 'SPS']","['Replaced', 'Programmed']",unable to duplicate the concern at this time radio and display both working normally and no current dtcs set found multiple historydtcs set with   appearing in the TCICM and amplifier but nothing failed at this time no bulletins found for this concernrequires more time to inspect further attempted to check for possible radio software updates as per shop managers request but SPSerror code   stop appears before programming screen is reached and unable to check for updated software no OTA softwareavailable at the time of inspection called Techline support for assistance and Daniel retrieved the radio module identifier numbersfor engineering unable to program the radio at this time as per Techline support case #  waiting for engineering responseadvise radio and display working normally during inspection never cut out even once radio cut out as described by the customerwhile checking for programming updates the second time dtc   reset current in the TCICM and amplifier and then went to historystatus when the radio came back on and reset to the factory agreements screen requires further diagnosis of the ethernet data linesat the radio diagnostics lead to radio replacement requires new radio module Customer reports that radio and screen is intermittantly inop Inspect and advise,Radio
D-14869,7/6/2020,"upon inspection radio screen was found to be blank with no sound . scanned for codes and found     lost communicationwithradio on ethernet bus to be stored in telemmatics communication interface control module . searched for bulletins and foundnonepertaining to this code . performed global systems reset by disconnecting battery , touching both cables together ,reconnectingbattery in order to reset power to radio . system reset was found to not work radio still inop . disconnected allconnectors attelematics module and radio in order to reset power to both modules . connector recconection was also found to notwork radio stillinop . placed a call to gm tac case number  -  spoke to ben and was instructed to begin circuit testing atradio . testedfor less than   ohms between each ground circuit terminal and ground at radio . all ground circuits were found tohave less   ohms at  .  ohms well with in spec as stated in service info . verified test lamp lights between each b+ circuitterminal andground indicating proper   volt battery power to radio as stated in service info . verified test lamp lights betweeneach ignitioncircuit term",and ground at radio as stated in service info . verified test light lights between ignition circuit terminals and ground atradiothat are controlled by a module as stated in service info . when verifying a test lamp lights between serial datacommunicationenable circuit and or accessory wakeup serial data circuit terminals and ground at radio the test lamp was found tonot light .performed resistance test on same circuits between radio and bcm and found there to be  .  k ohms well above spec ofless than   as stated in service info . placed a second call to gm tac spoke to jerry and was instructed to use data bus diagtool andverifiy radio is being seen on termianls   as well terminals   and   . radio was found to be present on both high   and   as well as low speed terminals   indicating proper operation of circuits between modules . was instructed toreplace radiobased on this information . replaced and programmed new radio as per tac instructions cleared codes and recheckedoperation . allsystems now operate as designed .,RADIO IS INOPERABLE CHECK AND ADVISE,2019-08-16T00:00:00.000Z,Fort Wayne,Module/Component-Shorted,Audio/Entertainment/Navigation - Other issues,2020-03-26T00:00:00.000Z,NebulaCruiser,StellarGlide,2020,FTW,['No Additional Functionality'],"['Radio', 'Display', 'Radio']","['Inoperative', 'Black Screen', 'No Sound']",['No Additional Context'],"['Radio', 'USB']","['Replaced', 'Programmed']","upon inspection radio screen was found to be blank with no sound . scanned for codes and found     lost communicationwithradio on ethernet bus to be stored in telemmatics communication interface control module . searched for bulletins and foundnonepertaining to this code . performed global systems reset by disconnecting battery , touching both cables together ,reconnectingbattery in order to reset power to radio . system reset was found to not work radio still inop . disconnected allconnectors attelematics module and radio in order to reset power to both modules . connector recconection was also found to notwork radio stillinop . placed a call to gm tac case number  -  spoke to ben and was instructed to begin circuit testing atradio . testedfor less than   ohms between each ground circuit terminal and ground at radio . all ground circuits were found tohave less   ohms at  .  ohms well with in spec as stated in service info . verified test lamp lights between each b+ circuitterminal andground indicating proper   volt battery power to radio as stated in service info . verified test lamp lights betweeneach ignitioncircuit term RADIO IS INOPERABLE CHECK AND ADVISE",Radio
D-14555,1/9/2020,Scanned found no codes checked for bulletins found none checked for updates in radio and telematics communication modulefoundnone found vehicles wifi hotspot to be working properly found when connecting to a wifi source for an agreement page toappearand then a loading symbol until an eventual connection failure notification and then disconnecting from wifi source Comparedtolike vehicle and found agreement page after connecting to wifi source to load almost immediately and was able to agree andcontinueusing wifi source Forgot all networks and called onstar and confirmed the vehicles internet and hotspot services wereenabledStarted tac case #     was called by a tac member and was instructed to reset all   setting in the radio tofactorysettings and attempt to connect to vehicles wifi again and found vehicles hotspot to be connected to the internet thenwasinstructed to connect to a alternate hotspot and was able but then taken to the agreement page followed promptly by aloadingscreen and then a connection failure message and the vehicle disconnecting itself from the alternate wifi Was instructed totakepictures of all loading and failure screens and sent to tac and swap the tcicm from problem vehicle to a like vehicle andattemptedthe same procedure found the agreement page to load in like vehicle with problem vehicles tcicm almost immediately Nectoreinstall problem and like vehicles tcicm back to original vehicle Was then instructed to replace radio nec to replace radioandprogram new radio and retest all wifi and connection features working fine at this time Tech         olh     forremovaland installation of tcicm in problem vehicle and installation of problem vehicle tcicm in like vehicle for testing andreinstallation of like vehicles tcicm after testing as well as diagnostic time with tac and comparing original problem tolikevehicle Total Time Tech       hours,radio module internal failure,CUSTOMER STATES RADIO SCREEN AND ONSTAR KEEPS ATTEMPTING TO CONNECT TO WIFI NETWORK WITH A PROMPT AND DECLINES EVERYTIME DUETODECLINE OF TERMS ONSTAR A TEAM AT AL SERRA AND GM HAVE ALL RECOMMENDED SEEING SERVICE DEPARTMENT AS,2019-08-06T00:00:00.000Z,Flint,Module/Component-Worn/Stripped,Audio/Entertainment/Navigation - Other issues,2019-11-29T00:00:00.000Z,ThunderVolt,HyperFury X,2020,FLT,['No Additional Functionality'],"['Display', 'OnStar', 'Radio Module']","['Inoperative', 'Inoperative', 'Internal Fault']",['No Additional Context'],['Radio'],['Replaced'],Scanned found no codes checked for bulletins found none checked for updates in radio and telematics communication modulefoundnone found vehicles wifi hotspot to be working properly found when connecting to a wifi source for an agreement page toappearand then a loading symbol until an eventual connection failure notification and then disconnecting from wifi source Comparedtolike vehicle and found agreement page after connecting to wifi source to load almost immediately and was able to agree andcontinueusing wifi source Forgot all networks and called onstar and confirmed the vehicles internet and hotspot services wereenabledStarted tac case #     was called by a tac member and was instructed to reset all   setting in the radio tofactorysettings and attempt to connect to vehicles wifi again and found vehicles hotspot to be connected to the internet thenwasinstructed to connect to a alternate hotspot and was able but then taken to the agreement page followed promptly by aloadingscreen and then a connection failure message and the vehicle disconnecting itself from the alternate wifi Was instructed totakepictures of all loading and failure screens and sent to tac and swap the tcicm from problem vehicle to a like vehicle andattemptedthe same procedure found the agreement page to load in like vehicle with problem vehicles tcicm almost immediately Nectoreinstall problem and like vehicles tcicm back to original vehicle Was then instructed to replace radio nec to replace radioandprogram new radio and retest all wifi and connection features working fine at this time Tech         olh     forremovaland installation of tcicm in problem vehicle and installation of problem vehicle tcicm in like vehicle for testing andreinstallation of like vehicles tcicm after testing as well as diagnostic time with tac and comparing original problem tolikevehicle Total Time Tech       hours CUSTOMER STATES RADIO SCREEN AND ONSTAR KEEPS ATTEMPTING TO CONNECT TO WIFI NETWORK WITH A PROMPT AND DECLINES EVERYTIME DUETODECLINE OF TERMS ONSTAR A TEAM AT AL SERRA AND GM HAVE ALL RECOMMENDED SEEING SERVICE DEPARTMENT AS,Radio
D-14704,4/14/2020,"PANTALLA SE PONE NEGRA, LO QUE PROVOCA QUE AL PONER EN REVERSA LA PALANCA DE VELOCIDADES, SE VEA OBSCURA, POR LO QUE SE DEBE SEPERSIBE MAL FUNCIONAMIENTO","DESPUES DE REALIZAR LA INPECCION VISUAL Y OPERATIVA NOS FUIMOS AL SIGUIENTE DIAGNOSTICO #   EL CUAL NOS DICE QUE SIGAMOS LOSSGUIENTES  . Ignición / Vehículo & Todos los sistemas del vehículo » Apagado(ok)  . Desconecte el conector eléctrico:   @   Radio(ok)Nota: Antes de probar el cable coaxial, revise si el cable ha sido pellizcado, cortado, dañado o si las conexiones han sidoaflojadas en los componentes, ya que esto puede causar problemas de recepción.  . Desconecte el conector eléctrico:   @   Módulo de control de procesamiento de vídeo (ok)  . Ubique el adaptador de contactos adecuado y el adaptador de circuito de prueba de carga del Juego de adaptador de cable FAKRACOAX EL- .  . Conecte los   adaptadores, mida y registre la resistencia entre las terminales en el adaptador de contactos. ( )  . Desconecte los   adaptadores y conecte cada uno al extremo adecuado del cable coax.(ok)  . Las terminales de prueba en el adaptador de contactos, mida la resistencia total del circuito del cable coax incluyendo eladaptador de prueba de carga conectado.⇒ Si no está dentro de   Ω de la lectura del paso  . (  OHZ)Reemplace el cable coaxial⇓ Si está dentro de   Ω de la lectura del paso  .Nota: Si la condición es intermitente o no se puede duplicar, desconecte los conectores y añada grasa dieléctrica o lubricante(Nyogel   o equivalente, que cumpla la especificación GM  ). Este procedimiento corregirá la condición de alta resistenciadebido a corrosión por fricción.  . Reemplace el componente:   Módulo de control de procesamiento de vídeo ( YA SE REMPLAZO)  . Aplique el freno de estacionamiento.( OK) . Motor en funcionamiento Transmisión en  . Verifique si el DTC   no esté establecido. ( SI SE RESTABLECE)⇒ Si el DTC está establecido,se por esta razón se debe remplazar el radio. Parte en ""backorder"" control de pedido :  paraque no se tome en cuenta en los métricos de TPU",PANTALLA SE PONE NEGRA,2019-08-12T00:00:00.000Z,Spring Hill - Truck,Module/Component-No/Incorrect Communication,Features/Controls/Displays - Other issues,2019-12-26T00:00:00.000Z,ThunderVolt,HyperFury X,2020,SHT,['When Reversing'],['Display'],['Black Screen'],['While Driving'],"['Radio', 'USB']","['Replaced', 'Programmed']","PANTALLA SE PONE NEGRA, LO QUE PROVOCA QUE AL PONER EN REVERSA LA PALANCA DE VELOCIDADES, SE VEA OBSCURA, POR LO QUE SE DEBE SEPERSIBE MAL FUNCIONAMIENTO PANTALLA SE PONE NEGRA",Other
D-15142,11/23/2020,INSPECTED VEHICLE       AND CONFIRMED THAT THE DISPLAY SHOWS A SATELLITE SIGNAL LOST ATTEMPTING TO RECONNECT ERRORANDTHESATELLITE RADIO DOES NOT WORK UNTILL THE VEHICLE IS TURNED OFF THEN BACK ON AGAIN,SCRANNED FOR CODES NONE FOUND FOUND UPDATE   NA   PERFORMED UPDATE GUEST WAS WAITING AND COULD NOT LEAVEVEHICLEFORDIAGNOSIS CONTACTED TAC CASE#     WHILE COMMUNICATING WITH TAC THE GUEST REACHED OUT AND STATED THATTHEISSUEPERSISTED TAC RECOMMEND TO CHECK THE COAXIAL CABLE FOR THE ANTENNA GUEST RETURNED       AND WAS SUPPLIED A CTPLOANVEHICLEDURING INSPECTION USING DIAGNOSTIC TREE DI#   TESTED CABLE AND FOUND     OHMS CHECKS OK CONTACTED TAC ANDORDEREDA HIGHREQUENCY ANTENNA PER TAC RECOMMENDATION AS THE ANTENNA HAS HIGH RESISTANCE DUE TO WORK RELEATED CONSTRAINTS GUESTPICKEDUPVEHICLE       PART ARRIVED       AND GUEST RETURNED       SUPPLIED WITH A CTP LOAN VEHICLE INSTALLEDHIGHFREQUENCYANTENNA AND CONFIRMED NORMAL SATELLITE RADIO OPERATION GUEST PICKED UP VEHICLE       AND CALLED SHORTLY AFTERSTATINGTHAT THECONDITION PERSISTS SERVICE MANAGER CONTACTED DMA AND TAC TO ESCALATE TAC CASE TO INVOLVE AN FSE GUEST RETURNED     WASSUPPLIED A CTP LOAN VEHICLE DUE TO A MISSCOMMUNICATION BETWEEN THE SERVICE MANAGER AND FSE THE FSE WAS UNABLE TOTRAVELTODEALERSHIP HOWEVER DID ADVISE TECHNICIAN TO PERFORM A USB FILE TRANSFER UPDATE FOR THE RADIO UNIT   NA   OPERATION OF THE VEHICLE AFTER UPDATE AND GUEST PICKED UP VEHICLE       GUEST CALLED SHORTLY FOLLOWINGANDSTATED THATTHE SATELLITE RADIO CONTINUES TO DISCONNECT AND NOT RECONNECT UNTILL THE VEHICLE IS TURNED OFF THEN ON AGAINSETAPPOINTMENT WITHFSE TO INSPCET VEHICLE ON       AND GUEST RETURNED ON       DROPPED VEHICLE OFF AND WAS SUPPLIED A CTPLOANVEHICLE FSEINSPECTED VEHICLE SPOKE WITH GUEST AND FOUND THE RADIO UNIT IS MALFUNCTIONING REPLACED THE RADIO UNIT PER THEFSERECOMMENDATION CONFIRMED NORMAL OPEATION MILEAGE RECORDED REFLECTS SHOP TEST DRIVES AND MILEAGE THAT GUEST PUT ON INBETWEENVISITS       OLH,CUSTOMER STATES A MESSAGE OF LOST SATELITE SIGNAL TRYING TO RECONNECT CHECK AND ADVISE,2019-08-27T00:00:00.000Z,Fort Wayne,Module/Component-Registers Incorrectly,Audio/Entertainment/Navigation - Other issues,2019-10-31T00:00:00.000Z,ThunderVolt,TurboFlare,2020,FTW,['No Additional Functionality'],['Radio'],['Malfunction'],['No Additional Context'],['Radio'],['Replaced'],INSPECTED VEHICLE       AND CONFIRMED THAT THE DISPLAY SHOWS A SATELLITE SIGNAL LOST ATTEMPTING TO RECONNECT ERRORANDTHESATELLITE RADIO DOES NOT WORK UNTILL THE VEHICLE IS TURNED OFF THEN BACK ON AGAIN CUSTOMER STATES A MESSAGE OF LOST SATELITE SIGNAL TRYING TO RECONNECT CHECK AND ADVISE,Radio
D-15149,3/11/2020,AS PER TAC REPLACE RADIO,"CHECK FOR SD CARD MISSING FOUND MISSING,INSTALL NEW SD CARD - FOUND 'G ENERAL INACCURACY ERROR  . . . .  RESTART NAV'RETRIED   TIM ES AS PER SD CARD REPLACE DOCUMENT STILL SAME FAULT - RESET ALL RADIO SETTINGS - RETRY SAME FAULT - AS PER SD CARDERROR WILL NEED TO REPLAC E SD CARD READER........ DISASSEMBLE TO GAIN ACCESS TO SD CARD READER ASM,REMOVE SD CARD READER -INSTALL KNOWN GOOD READER - INSTALL NEW SD CARD FOUND SAME FAULT,TEST  -  INPUT PORT - USB PORT WITH MIT TESTER FOUND BOTHWORKING CORRECTLY - PERFORM GLOBAL RESET PROCEDURE FOUND ST ILL ERROR AFTER   MINS - CALLED TAC SPOKE WITH RON GAUGNIA CASE#  WHO ADVISED ME TO REPLACE RADIO ASM - ORDERED RADIO.------REPLAC ED THE RADIO AS DIRECTED BY TAC AND COMPLETEDPROGRAMMING(CODE=   ) AND COMPLETED THE USB PROGRAMMING(CODE= ). CLEARED A LL PROGRAMMING DTC AND FOUND THECONDITION TO BE THE SAME. INSPECTED F OR AFTER MARKET COMPONENTS AND FOUND NONE. CALLED TAC BACK AND SPOKE W ITH ROBERT. WASDIRECTED TO JUMP THE SD CARD READER DIRECTLY TO THE RA DIO. REQUEST TIME TO DO SO.....ET PUNCH TO DISSASSEMBLE CENTER CONSOLE TOACCESS WIRING,  .  HR .,.WF  - - .  - . REMOVED THE RADIO A ND HVAC CONTROL ASSY. INSTALLED THE   DIRECTLY TO THE   O F THE  (DIRECT TO THE RADIO AND FOUND THE CONDITION TO BE THE SAME. ASSEMBLED ALL COMPONENTS AS REQUIRED. WILL CALLTAC. CALLED AND SPOKE WITH JIM, WAS DIRECTED TO REPLACED THE USB CABLE BETWEEN THE   USB P ORT AND RADIO. FOUND THE PART THATSHOWED UP TO BE INCORRECT. HOLDING FOR DATA CABLE FROM THE   USB PORT(CENTER STACK) TO THE RADIO. HOLDI NG..TOTAL DW OF  .  PLUSLABOR OP .,.WF  - - ",CUSTOMER REPORTS SD CARD IS MISSING AT TIME OF DELIVERY - PLEASE ORDER,2019-08-27T00:00:00.000Z,Silao,Module/Component-Discharge,Audio/Entertainment/Navigation - Audio,2020-02-29T00:00:00.000Z,ThunderVolt,ShadowPulse,2020,SIL,,,,,,,AS PER TAC REPLACE RADIO CUSTOMER REPORTS SD CARD IS MISSING AT TIME OF DELIVERY - PLEASE ORDER,Radio
D-14666,11/18/2019,INTERNAL FAULT TO RADIO MODULE CAUSING INTERMITTENT BLANK SCREEN WHILE DRIVING.,"VERIFIED CUSTOMERS CONCERN. FOUND INTERMITTENT NO AUDIO CONDITION PRESENT. DURING TEST DRIVE AUDIO CUT OUT. SCANNED FOR DTCS,   SET AND CURRENT AND MULTIPLE LOSS OF COMM CODES. VERIFIED BATTERY GOOD. CONTACTED TAC. CASE # - . PER TAC ERASEDCUSTOMERS IPHONE FROM VEHICLE AND RECHECKED. FOUND NO AUDIO CONDITION STILL PRESENT. PER TAC REC REPLACING RADIO TO CORRECTCONCERN. REPLACED RADIO. PERFORMED SPS PROGRAMMING. RADIO SPS WARRANTY CODE- . ATTACHED PRINTOUT TO RO AND CLEAREDPROGRAMMING DTCS. FOUND AFTER REPAIR AUDIO STILL INOP. FOUND CHIME AUDIO PRESENT. REMOVED REAR SEAT BACK ASSEMBLY FOR ACCESS TOAMPLIFIER. PERFORMED INSPECTION, FOUND AMPLIFIER CONNECTIONS SECURED. PERFORMED END TO END TESTING FROM AMPLIFIER TO RADIO TO TESTETHERNET CONNECTION. TESTED FROM RADIO   PIN   TO AMP   PIN  -  .  OHMS. GOOD. RAIDO   PIN   TO AMP   PIN  - OPEN. REMOVEDRIGHT FRONT KICK PANEL TO GAIN ACCESS TO INLINE CONNECTOR  . PERFORMED INSPECTION OF TERMINALS. FOUND MALE   PIN   BENT ANDNOT MAKING CONTACT WITH FEMALE SIDE OF CONNECTOR CAUSING OPEN CONDITION. BENT TERMINAL BACK STRAIGHT. TESTED RADIO, FOUND AUDIO ANDALL CONTROLS OPERATING AS DESIGNED. PER TAC ORDERED NEW CONNECTOR DUE TO DAMAGED TERMINALS. NO TERMINATED LEADS AVAILABLE.  .  B,  .  D ,  .  OLH ---- OLH = remove rear seat to gain access in order to pin test amp to radio wiring, remove right front kickpanel, and to test connector  ","C/S: CUSTOMER STATED STEREO SCREEN WENT BACK, NO AUDIO, STEERING WHEEL COMMANDS AND KNOB COMMANDS ON HEAD UNIT DID NOT WORK ASDESIGNED ALL CAME BACK NORMAL ON NEXT IGNITION CYCLE,PLEASE ADVISE",2019-08-09T00:00:00.000Z,Fort Wayne,Module/Component-No/Incorrect Communication,Audio/Entertainment/Navigation - Other issues,2019-11-15T00:00:00.000Z,ThunderVolt,ShadowPulse,2020,FTW,,,,,,,"INTERNAL FAULT TO RADIO MODULE CAUSING INTERMITTENT BLANK SCREEN WHILE DRIVING. C/S: CUSTOMER STATED STEREO SCREEN WENT BACK, NO AUDIO, STEERING WHEEL COMMANDS AND KNOB COMMANDS ON HEAD UNIT DID NOT WORK ASDESIGNED ALL CAME BACK NORMAL ON NEXT IGNITION CYCLE,PLEASE ADVISE",Radio
D-14857,5/20/2020,"COULD NOT VERIFY CONCERN EVEN AFTER CYCLING THRU PARK/REVERSE/DRIVE SEVERAL TIMES.SCAN FOR FAULT CODES . -  AND  -  . OPENED TAC CASE  - . WAITING ON FEEDBACK . AS PER TAC ""Referencing Document ID:  , I would check coax connections at the radio, the   and the VPCM   for any issues as a weak connection could cause us issues."" TACFEEDBACK Dave Based on the information youprovided I recommend we replace the radio and evaluate. If the concern returns with thesame code replace the coax. Have a great day and I want to make sure I ve given youall the information you need to repair this vehicle.","INSTALL   RADIO CODES  -    CIRCUIT AND  -  MICROPHONE INPUT CIRCUITS SET , RECHECK ALL CONNECTIONS OK . CHECK ALL RELATED CONNECTIONS OUTSIDE OF   RADIO OK . PLEASENOTE THESE CODES ARE NEW CODES NEVER PRESENT IN OLD   MODULE . REMOVE NEW   RADIO AND REINSTALL OLD   RADIO RECHECK FOR CODES ,NONE STORED INDICATES FAILED NEW   RADIO . PARTSREQ SENT FOR ANOTHER   RADIO .INSTALLED   REPLACEMENT   RADIO ,SAME   CODESRETURNED . CONTACTED TAC ON  / /  WAITING ON FEEDBACK .CONTACTED TECH LINE.TECHLINE PROVIDED GUIDANCE ON A UNIQUE PROGRAMMING SEQUENCE NOT LISTED IN S.I. Document ID:   VERIFIED ANTENNA AND MIC CODES CLEARED . VERIFY PROPER   RADIO OPERATION AND MONITOR BACK UP CAMERA FUNCTION .WARRANTY CLAIM CODE ON SUCCESSFUL PROGRAM SESSION   CUSTOMER WILL HAVE TO CALL XM AND ACTIVATE SATELITE RADIO//olh  .  auth e","  MINOR ELECTRICAL CUST STATES BACK UP CAMERA INOP INTERMITTENTLY AGAIN, SCREEN GOING BLACK WITH A PICTURE OF CAMERA WITH A LINE THOUGH IT...KERRIE HAS PICTURE..CHK & ADV AUTH BY MS KUZMAK ROCHE  / / :  REPLACE   RADIO   (TECHNICAR)  . ",2019-08-16T00:00:00.000Z,Spring Hill - Truck,Module/Component-No/Incorrect Communication,Audio/Entertainment/Navigation - Video,2019-09-10T00:00:00.000Z,NovaSprint,FusionNova,2020,SHT,,,,,,,"COULD NOT VERIFY CONCERN EVEN AFTER CYCLING THRU PARK/REVERSE/DRIVE SEVERAL TIMES.SCAN FOR FAULT CODES . -  AND  -  . OPENED TAC CASE  - . WAITING ON FEEDBACK . AS PER TAC ""Referencing Document ID:  , I would check coax connections at the radio, the   and the VPCM   for any issues as a weak connection could cause us issues."" TACFEEDBACK Dave Based on the information youprovided I recommend we replace the radio and evaluate. If the concern returns with thesame code replace the coax. Have a great day and I want to make sure I ve given youall the information you need to repair this vehicle.   MINOR ELECTRICAL CUST STATES BACK UP CAMERA INOP INTERMITTENTLY AGAIN, SCREEN GOING BLACK WITH A PICTURE OF CAMERA WITH A LINE THOUGH IT...KERRIE HAS PICTURE..CHK & ADV AUTH BY MS KUZMAK ROCHE  / / :  REPLACE   RADIO   (TECHNICAR)  . ",Radio
