Event id,Opened date,CAUSAL_VERBATIM,CORRECTION_VERBATIM,CUSTOMER_VERBATIM,BUILD_DATE,BUILD_PLANT_DESC,CAUSAL_CD_DESC,COMPLAINT_CD_DESC,IN_USE_DATE,MAKE,MODEL,MODLYR,PLANT,Trigger,Failure Component,Failure Condition,Additional Context,Fix Component,Fix Condition,Combined_Text,Extracted_Component
D-15215,1/24/2020,RADIO SHORTED INTERNALLY," , VERIFIED CONCERN. FOUND CODE     IN THE RADIO. TESTED ALL WIRING, COAX CABLE, CONNECTIONS, AND RADIO. FOUND THAT RADIOHAD A INT ERNAL SHORT AND WAS REPLACED. REPROGRAMMED, CODE  . RE-EVAL UATED AND CONCERN WAS NO LONGER REPRODUCED.","CUSTOMER STATES THE REAR BACK UP CAMERA IS INTERMITTENTLY NOT WORKING, IT WILL SHOW A DARK SCREEN WITH TWO ICONS, A RED TRIANGLEWITH AN EXC LAMATION MARK AND THE OTHER A CAMERAWITH A RED LINE THROUGH IT- SEE TI NA",2019-08-28T00:00:00.000Z,Fort Wayne,Module/Component-Shorted,Audio/Entertainment/Navigation - Video,2019-12-26T00:00:00.000Z,NebulaCruiser,StellarGlide,2020,FTW,,,,,,,"RADIO SHORTED INTERNALLY CUSTOMER STATES THE REAR BACK UP CAMERA IS INTERMITTENTLY NOT WORKING, IT WILL SHOW A DARK SCREEN WITH TWO ICONS, A RED TRIANGLEWITH AN EXC LAMATION MARK AND THE OTHER A CAMERAWITH A RED LINE THROUGH IT- SEE TI NA",Radio
D-15178,4/27/2020,"TECH INSPECTED AND VERIFIED CUSTOMER CONCERN TECH FOUND NO AUDIO COMING FROM RADIO TECH REMOVED AND REPLACED BACK SEAT TO GAINACCESS TO AMP, CHECKED CIRCUITS FROM RADIO TO AMP AND TESTED GOOD, TECH FOUND INTERNAL FAULT IN AMP","TECH REPLACED RADIO AMPLIFIER AND REPROGRAMMED TO CORRECT CONCERN LABOR OP  ,  .  REPLACEMENT  .  DIAGNOSIS,  .  LABOR TIMETOTAL REPROGRAM CLAIM CODE   Y",C/S RADIO DON'T COME ON WHEN HE GETS IN -HE HAS TO PUSH BUTTON IS INTERMITTENTLY UNRESPONSIVE,2019-08-28T00:00:00.000Z,Fort Wayne,Module/Component-Shorted,Audio/Entertainment/Navigation - Other issues,2020-02-26T00:00:00.000Z,ThunderVolt,QuantumRider,2020,FTW,,,,,,,"TECH INSPECTED AND VERIFIED CUSTOMER CONCERN TECH FOUND NO AUDIO COMING FROM RADIO TECH REMOVED AND REPLACED BACK SEAT TO GAINACCESS TO AMP, CHECKED CIRCUITS FROM RADIO TO AMP AND TESTED GOOD, TECH FOUND INTERNAL FAULT IN AMP C/S RADIO DON'T COME ON WHEN HE GETS IN -HE HAS TO PUSH BUTTON IS INTERMITTENTLY UNRESPONSIVE",Radio
D-15046,6/24/2020,FOUND RADIO SOFTWARE UPDATE TO CORRECT VEHICLE RADIO CONCERN. PERFORMED RADIO PROGRAMMING USB AND ERROR OCCURRED AT   PERCENT OFSOFTWARE UPDATE CAUSING RADIO LOCK UP AND LOSS RADIO COMMUNICATIONS. PERFORMED VEHICLE POWER CYCLE AND REATTEMPT PROGRAMMING.VEHICLE NEEDING RADIO REPLACED.,REPLACED RADIO ASSEMBLY AND PERFORMED RADIO PROGRAMMING WITH SPS AND PERFORMED USB PROGRAMMING. CLEARED MEC AND INSPECT RADIOOPERATION.,CUSTOMER STATES THAT THE RADIO SCREEN KEEP GOING OUT,2019-08-23T00:00:00.000Z,Silao,Module/Component-No/Incorrect Communication,Audio/Entertainment/Navigation - Video,2019-10-05T00:00:00.000Z,ThunderVolt,TurboFlare,2020,SIL,,,,,,,FOUND RADIO SOFTWARE UPDATE TO CORRECT VEHICLE RADIO CONCERN. PERFORMED RADIO PROGRAMMING USB AND ERROR OCCURRED AT   PERCENT OFSOFTWARE UPDATE CAUSING RADIO LOCK UP AND LOSS RADIO COMMUNICATIONS. PERFORMED VEHICLE POWER CYCLE AND REATTEMPT PROGRAMMING.VEHICLE NEEDING RADIO REPLACED. CUSTOMER STATES THAT THE RADIO SCREEN KEEP GOING OUT,Radio
D-14874,3/31/2021,"WHEN CONCERN HAPPENS AND POWER IS REMOVED TO RADIO, RADIO WILL RESET. RADIO HAS CURRENTCALIBRATIONS. RADIO FAILED.",REPLACED AND PROGRAMMED RADIO.,CUSTOMER STATES HIS INFOTAINMENT CENTER RANDOMLY AND INTERMITTENTLY COMES ON BY ITSELF CUSTOMER SAID EVENWITHTHEUNITTURNEDOFFWHENHESTARTS THE VEHICLE AND \BEGINS TO BACK OUT THE RADIO WILL COME ON CUSTOMER SAID THE PROBLEMUSUALLYHAPPENSATSTARTUPPARTS WEREORDEREDDURING LAST VISIT AND HAVE ARRIVED PLEASE INSTALL AND OR ADVISE,2019-08-16T00:00:00.000Z,Lansing Delta,Module/Component-No/Incorrect Communication,Audio/Entertainment/Navigation - Audio,2020-01-07T00:00:00.000Z,NovaSprint,NebulaJet,2020,DEL,,,,,,,"WHEN CONCERN HAPPENS AND POWER IS REMOVED TO RADIO, RADIO WILL RESET. RADIO HAS CURRENTCALIBRATIONS. RADIO FAILED. CUSTOMER STATES HIS INFOTAINMENT CENTER RANDOMLY AND INTERMITTENTLY COMES ON BY ITSELF CUSTOMER SAID EVENWITHTHEUNITTURNEDOFFWHENHESTARTS THE VEHICLE AND \BEGINS TO BACK OUT THE RADIO WILL COME ON CUSTOMER SAID THE PROBLEMUSUALLYHAPPENSATSTARTUPPARTS WEREORDEREDDURING LAST VISIT AND HAVE ARRIVED PLEASE INSTALL AND OR ADVISE",Radio
D-14665,1/14/2020,RADIO SHORTED,CUSTOMER CONCERN VERIFIED. SURROUND VISION SYSTEM IN-OP UPON ARRIVAL.   SET TO CURRENT IN RADIO. VPCM ALREADY REPLACED.COAXIALFROM VPC M TO RADIO LESS THAN  .  OHM END TO END OUTER SHIELD AND INNER PIN. CA N GET PICTURE BACK IF CONNECTOR AT RADIO ISHELD INA CERTAIN POSITION . REMOVE AND REPLACE RADIO COMPLETE. RADIO PROGRAMMING AND USB FILE TR ANSFER COMPLETE (WCC- ).VERIFY PROPER OPERATION. ALL OK.,CUSTOMER STATES BACK UP CAMERA IS NOT WORKING - SOP IN,2019-08-09T00:00:00.000Z,Fort Wayne,Module/Component-Shorted,Features/Controls/Displays - Other issues,2020-11-03T00:00:00.000Z,NebulaCruiser,StellarGlide,2020,FTW,,,,,,,RADIO SHORTED CUSTOMER STATES BACK UP CAMERA IS NOT WORKING - SOP IN,Radio
D-15086,3/4/2020,PERFORMED A VEHICLE DIAGNOSTIC CHECK. NO DTCSPERFORMED MULTIPLE ROAD TESTS. STARTED TACCASE  - .INSPECTED RADIO CONNECTIONSTAC SUGGESTS REPLACEMENT OF RADIO.,REPLACED RADIO.PERFORMED MODULE PROGRAMMING:   USB FILE TRANSFER:   CODE E FOR TIME TO GAIN ACCESS TO & PERFORMRADIO CIRCUIT/CONNECTION TESTING,"CUSTOMER REPORTS INFOTAINMENT DISPLAY GOESBLANK INTERMITTENLY, BACK UP CAMERA STILLWORKS WHILE THIS IS HAPPENING.   DIAG TOPERFORM PRELIM CHECKS & MULTIPLE TEST DRIVES.",2019-08-23T00:00:00.000Z,Fort Wayne,Module/Component-No/Incorrect Communication,Audio/Entertainment/Navigation - Video,2019-09-20T00:00:00.000Z,NebulaCruiser,StellarGlide,2020,FTW,,,,,,,"PERFORMED A VEHICLE DIAGNOSTIC CHECK. NO DTCSPERFORMED MULTIPLE ROAD TESTS. STARTED TACCASE  - .INSPECTED RADIO CONNECTIONSTAC SUGGESTS REPLACEMENT OF RADIO. CUSTOMER REPORTS INFOTAINMENT DISPLAY GOESBLANK INTERMITTENLY, BACK UP CAMERA STILLWORKS WHILE THIS IS HAPPENING.   DIAG TOPERFORM PRELIM CHECKS & MULTIPLE TEST DRIVES.",Radio
D-15232,3/23/2021,"- CONFIRMED CUSTOMER CONCERN, SCANNED AND FOUND NO CODES PERTAINING TORADIO - DATA APPEARS NORMAL - CHECK FOR UPDATES - PROGRAMRADIO W/C    - USB -   NORMAL - RADIO LOCKED WHILE USB PROGRAMMING - DISCONNECTED BATTERY FOR   MINUTES -R",- TOUCH SCREEN INOP AND DOES NOT RESPOND - REPLACED DISPLAY AND CONFIRMED PROPER OPERATION - REPLACED RADIO AND PROGRAMED W/  - USB W/C   - VERIFIED PROPER OPERATION - VEHICLE IS WORKING AS DESIGNED,CUSTOMER STATES TOUCH SCREEN IS INOP,2019-08-29T00:00:00.000Z,Flint,Wiring/Electrical/Sensors-No/Incorrect Communication,Audio/Entertainment/Navigation - Communication,2020-02-29T00:00:00.000Z,NovaSprint,FusionNova,2020,FLT,,,,,,,"- CONFIRMED CUSTOMER CONCERN, SCANNED AND FOUND NO CODES PERTAINING TORADIO - DATA APPEARS NORMAL - CHECK FOR UPDATES - PROGRAMRADIO W/C    - USB -   NORMAL - RADIO LOCKED WHILE USB PROGRAMMING - DISCONNECTED BATTERY FOR   MINUTES -R CUSTOMER STATES TOUCH SCREEN IS INOP",Radio
D-15202,8/14/2020,FOUND BLUETOOTH NOT CONNECTING AT TIMES CODE,VERIFIED CUSTOMER'S CONCERN. FOUND THE BLUETOOTH NOT CONNECTING AT TIM ES. SCANNED FOR DTC'S AND FOUND   SET. PERFORMEDELECTRICAL DIAGNO STICS WITH A DMM AND VERIFIED ALL RADIO CIRCUITS ARE OPERATING AS DESI GNED AT THIS TIME. REPLACED THE RADIO ANDPROGRAMMED THE RADIO VIA SPS . (WCC-  ) VERIFIED THE BLUETOOTH FEATURES OPERATE AS DESIG NED AFTER REPAIRS.,CUSTOMER STATES IPHONE WILL INTERMITTENTLY NOT CONNECT TO BLUETOOTH,2019-08-28T00:00:00.000Z,Spring Hill - Truck,Module/Component-No/Incorrect Communication,Audio/Entertainment/Navigation - Other issues,2019-10-23T00:00:00.000Z,NebulaCruiser,ThunderBlitz,2020,SHT,,,,,,,FOUND BLUETOOTH NOT CONNECTING AT TIMES CODE CUSTOMER STATES IPHONE WILL INTERMITTENTLY NOT CONNECT TO BLUETOOTH,Other
D-14481,2/12/2020,NAVIGATION SYSTEM,TEST DROVE. NO PROBLEM FOUND. WORKING AS DESIGNED AT THIS TIME. NO COD ES STORED. NAVIGATION WORKS UNDER GUEST USER PROFILE. DOESNOT WORK UN DER CUSTOMER SETUP PROFILE. REPLACED RADIO PER TAC ON EARLIER REPAIR O RDER. PROGRAM NEW RADIO. PERFORMED USB FILETRANSFER TO NEW RADIO. CLE ARED CODES. TEST DROVE. NAVIGATION WORKS AT THIS TIME. RADIO PROGRAM C LAIM CODE   USB FILETRANSFER CLAIM CODE,TRIM ELECTRICAL - NAVIGATION SYSTEM NOT READING/OPERATING,2019-08-02T00:00:00.000Z,Flint,Module/Component-Alignment/Adjustment,Audio/Entertainment/Navigation - Communication,2019-09-03T00:00:00.000Z,ThunderVolt,QuantumRider,2020,FLT,,,,,,,NAVIGATION SYSTEM TRIM ELECTRICAL - NAVIGATION SYSTEM NOT READING/OPERATING,Other
D-14973,11/3/2020,SCANNED FOR CODES FOUND NO COMMUNICATION WITH RADIO TESTED RADIO POWER AND GROUND CIRCUITS NO PROBLEM FOUND TESTEDDATACOMMUNICATION CIRCUITS FOR OPENS SHORTS AND OPENS NO PROBLEM FOUND RADIO IS INOPERABLE,REPLACED RADIO ASSEMBLY REPROGRAMMED op code       DIAGNOSIS       Install Software with USB   Configure SetupReprogramRadio with SPS PROGRAM WCC   USB FILE TRANSFER WCC   NET ITEM     ADMINISTRATIVE ALLOWANCE,SALES STATES RADIO IS NOT TURNING ON CHECK AND ADVSIE,2019-08-20T00:00:00.000Z,Lansing Delta,Module/Component-Shorted,Audio/Entertainment/Navigation - Other issues,2021-02-04T00:00:00.000Z,TurboFlux,SolarStriker,2020,DEL,,,,,,,SCANNED FOR CODES FOUND NO COMMUNICATION WITH RADIO TESTED RADIO POWER AND GROUND CIRCUITS NO PROBLEM FOUND TESTEDDATACOMMUNICATION CIRCUITS FOR OPENS SHORTS AND OPENS NO PROBLEM FOUND RADIO IS INOPERABLE SALES STATES RADIO IS NOT TURNING ON CHECK AND ADVSIE,Radio
D-14895,7/15/2020,ED IGNITION AND CADILLAC SPLASH SCREEN REAPPEARED. CALL TAC STARTED GCUS- -  CASE. THEYRECOMMENDED RESET RADIO. PERFORMED RESET STILL SHOWS CADILLAC. TAC THEN RECOMMENDED REPLA,CE RADIO. REPLACED RADIO AND PROGRAMMED PROGRAM CODE   AND PERFORMED USB FILE TRANSFER PROGRAM CODE  .CYCLED IGNITION NOWS SHOWS GMC.,SPLASH SCREEN SHOWS CADILLAC LOGO. CHECKED FRCODES NO CODES STORED. PROGRAMMED RADIO. PROGRAM CODE  . PERFORMED USB FILE TRANSFER PROGRAM PROGAM CODE  . CYCL,2019-08-17T00:00:00.000Z,Flint,Module/Component-No/Incorrect Communication,Audio/Entertainment/Navigation - Other issues,2019-10-28T00:00:00.000Z,NovaSprint,NebulaJet,2020,FLT,,,,,,,ED IGNITION AND CADILLAC SPLASH SCREEN REAPPEARED. CALL TAC STARTED GCUS- -  CASE. THEYRECOMMENDED RESET RADIO. PERFORMED RESET STILL SHOWS CADILLAC. TAC THEN RECOMMENDED REPLA SPLASH SCREEN SHOWS CADILLAC LOGO. CHECKED FRCODES NO CODES STORED. PROGRAMMED RADIO. PROGRAM CODE  . PERFORMED USB FILE TRANSFER PROGRAM PROGAM CODE  . CYCL,Radio
D-15205,3/9/2020,FOUND A   SECOND DELAY BETWEEN THE DIM SCREEN IN A LOW LIGHT CONDITION AND A BRIGHT LIGHT IN A HIGH LIGHT CONDITION.CONTACTEDTACAND WAS ADVISED TO REPLACE THE RADIO AND THE SCREEN. COMPARED TO MULTIPLE VEHICLES AND FOUND THAT ON SYSTEMS   THE DELAY IS HIGHER THAN ONES WITHOUT   DEGREE VIEW.,REPLACED RADIO AND DISPLAY. OLH FOR DISPLAY REPLACEMENT AND EXCESS DIAG WITH TAC. PROGRAM CODES FOR RADIO   OP CODE,CUST STATES THAT BACK UP CAMERA PICTURE IS DARK AT TIMES.,2019-08-28T00:00:00.000Z,Lansing Delta,Module/Component-Shorted,Audio/Entertainment/Navigation - Other issues,2019-11-19T00:00:00.000Z,NebulaCruiser,ThunderBlitz,2020,DEL,,,,,,,FOUND A   SECOND DELAY BETWEEN THE DIM SCREEN IN A LOW LIGHT CONDITION AND A BRIGHT LIGHT IN A HIGH LIGHT CONDITION.CONTACTEDTACAND WAS ADVISED TO REPLACE THE RADIO AND THE SCREEN. COMPARED TO MULTIPLE VEHICLES AND FOUND THAT ON SYSTEMS   THE DELAY IS HIGHER THAN ONES WITHOUT   DEGREE VIEW. CUST STATES THAT BACK UP CAMERA PICTURE IS DARK AT TIMES.,Radio
D-14871,1/16/2020,scanned for codes found none followed si diag for xm radio malfunction installed j tool coax antenna and cord parked vehicle inclear view of satelites radio still malfunctioning tested for xm signal and radio reception frequencies all systems tested normalad within spec recommend replacement of radio,diagnosed and replaced radio.,CS XM radio will come on when first starting but will shut off after about   seconds Will come back on if you press any otherstation,2019-08-16T00:00:00.000Z,Fort Wayne,Module/Component-No/Incorrect Communication,Audio/Entertainment/Navigation - Audio,2019-12-19T00:00:00.000Z,ThunderVolt,QuantumRider,2020,FTW,,,,,,,scanned for codes found none followed si diag for xm radio malfunction installed j tool coax antenna and cord parked vehicle inclear view of satelites radio still malfunctioning tested for xm signal and radio reception frequencies all systems tested normalad within spec recommend replacement of radio CS XM radio will come on when first starting but will shut off after about   seconds Will come back on if you press any otherstation,Radio
D-14643,11/7/2019,INTERNAL RADIO MODULE FAILURE,"ATTEMPTED TO RESTORED COMMUNICATIONS WITH RADIO MODULE -- DTCS  ,    ,  -- PERFORMED GLOBAL RESET, NO CHANGE -- REMOVEDRADIO AND ONSTAR FUSES FOR   MINUTES AND CYCLED -- NO CHANGED -- PHYSICALLY UNP LUGGED MODULE AND FOUND STILL NO OPERATION.  .  -- GROUND .  OHMS -- DATA PRESENT -- TAC CASE  -  -- REPLACED THE RADIO MO DULE AND SPS PROGRAMMED -  -- SYSTEM OPERATION RESTORED",CUST STATES THAT THE RADIO IS INOP. NO SOUND OR DISPLAY,2019-08-09T00:00:00.000Z,Fort Wayne,Module/Component-No/Incorrect Communication,Audio/Entertainment/Navigation - Audio,2019-10-23T00:00:00.000Z,ThunderVolt,TurboFlare,2020,FTW,,,,,,,INTERNAL RADIO MODULE FAILURE CUST STATES THAT THE RADIO IS INOP. NO SOUND OR DISPLAY,Radio
D-15396,1/29/2020,RADIO HAS INTERNAL FAILURE.,"TIME FOR PREVIOUS DIAGNOSIS AND GM TECHNICAL ASSISTANCE CASE # - , REPLACED RADIO PER TECHNICAL ASSISTANCE INSTRUCTIONSANDPROGRAM RADIO. RETEST OPERATION TO VERIFY REPAIR.",CUSTOMER STATES THAT RADIO SCREEN AT TIMES GOES BLACK. NO AUDIO IS HEARD. RADIO FUNCTIONS STOP WORKING. SCREEN WILL COME BACK ONITSOWN. ALSO WHEN RADIO SCREEN IS ON AUDIO CAN NOT BE CHANGED WAS IN FOR SIMILAR CONCERN ON  / /  RP     MILESSPECIALORDERED RADIO HERE,2019-09-06T00:00:00.000Z,Silao,Module/Component-No/Incorrect Communication,Audio/Entertainment/Navigation - Audio,2019-10-29T00:00:00.000Z,ThunderVolt,TurboFlare,2020,SIL,,,,,,,RADIO HAS INTERNAL FAILURE. CUSTOMER STATES THAT RADIO SCREEN AT TIMES GOES BLACK. NO AUDIO IS HEARD. RADIO FUNCTIONS STOP WORKING. SCREEN WILL COME BACK ONITSOWN. ALSO WHEN RADIO SCREEN IS ON AUDIO CAN NOT BE CHANGED WAS IN FOR SIMILAR CONCERN ON  / /  RP     MILESSPECIALORDERED RADIO HERE,Radio
D-14926,4/9/2021,RADIO HEADER LOOSE,REPLACED RADIO PROGRAMMED AND UPDATED WITH USB ......... CONFIRMED CUS TOMERS CONCERN. PERFORMED TSB  -NA-  DOCUMENT ID- .HELD COA X CABLE AN INCH FROM RADIO AND GENTLY MOVED CONNECTION. FOUND REVERSE CAMERA TURNING BLACK. PER TSB  -NA-  ID-  RA DIO DUE TO LOOSE HEADER. REPLACED RADIO WORKING AS DESIGN AT THIS TIME . WARRANTY CODE,CUSTOMER STATES THAT THE BACK UP CAMERA IS NOT SHOWING UP AND THEY ARE GETTING RED ERROR TRIANGLE IN THE SCREEN,2019-08-19T00:00:00.000Z,Spring Hill - Truck,Module/Component-Worn/Stripped,Features/Controls/Displays - Other issues,2019-09-03T00:00:00.000Z,NebulaCruiser,StellarGlide,2020,SHT,,,,,,,RADIO HEADER LOOSE CUSTOMER STATES THAT THE BACK UP CAMERA IS NOT SHOWING UP AND THEY ARE GETTING RED ERROR TRIANGLE IN THE SCREEN,Radio
D-14793,2/24/2021,VERIFIED CUSTOMER CONCERN. CONNECTED MDI AND SCANNED VEHICLE. NO CODES AT THIS TIME. PERFORMED UPDATE TO RADIO. CHECKED AFTERREPAIRS. RADIO STILL ON AFTER VEHICLE SHUTS DOWN. RADIO NOT FALLING ASLEEP AT THIS TIME. NECESSARY TO REPLACE.,REMOVED AND REPLACED RADIO. CONNECTED MDI AND PROGRAMMED.  . CHECKED AFTER REPAIRS. RADIO SCREEN NOW SHUTTING DOWN WHENVEHICLE IS SHUT OFF.,CUSTOMER CONCERN WITH RADIO AFTER TURNING VEHICLE OFF THEN OPENING DOORS RADIO STAYS ON,2019-08-14T00:00:00.000Z,Lansing Delta,Module/Component-No/Incorrect Communication,Features/Controls/Displays - Other issues,2019-12-19T00:00:00.000Z,ThunderVolt,HyperFury X,2020,DEL,,,,,,,VERIFIED CUSTOMER CONCERN. CONNECTED MDI AND SCANNED VEHICLE. NO CODES AT THIS TIME. PERFORMED UPDATE TO RADIO. CHECKED AFTERREPAIRS. RADIO STILL ON AFTER VEHICLE SHUTS DOWN. RADIO NOT FALLING ASLEEP AT THIS TIME. NECESSARY TO REPLACE. CUSTOMER CONCERN WITH RADIO AFTER TURNING VEHICLE OFF THEN OPENING DOORS RADIO STAYS ON,Radio
D-14531,9/28/2020,MEC RESET AND PROGRAMMING OF MODULE SHOWED NO IMPROVEMENT REPLACED RADIO AS DIRECTED BY TAC NO WIFI CONDITION WAS STILL       DIAG     OLH IS FOR EXTRA DIAG,FURTHER DISCUSSION WITH TAC REVEALED A MISMATCH OF DATABASE INFORMATION BETWEEN AT T AND GM NO VEHICLE CONCERN WAS FOUND ISSUEWASRESOLVED WITH HELPFROM TAC TO CORRECT DATABASE MISMATCH TAC #,C S WIFI USED TO WORK BUT NOW IT DOESNT BEEN TALKING TO GM AND AT T AND ONSTAR STATED THAT THE TRUCK HAS AN ISSUE,2019-08-05T00:00:00.000Z,Lansing - LGR,Module/Component-Shorted,Audio/Entertainment/Navigation - Communication,2019-08-23T00:00:00.000Z,NovaSprint,ElectroStreak,2020,LGR,,,,,,,MEC RESET AND PROGRAMMING OF MODULE SHOWED NO IMPROVEMENT REPLACED RADIO AS DIRECTED BY TAC NO WIFI CONDITION WAS STILL       DIAG     OLH IS FOR EXTRA DIAG C S WIFI USED TO WORK BUT NOW IT DOESNT BEEN TALKING TO GM AND AT T AND ONSTAR STATED THAT THE TRUCK HAS AN ISSUE,Radio
D-15129,1/21/2020,LOSING COMMUNICATION,"COULD NOT DUPLICATE. CALLED TAC, AFTER SOME QUESTIONS FOR CUSTOMER AND DIAGNOSTICS WAS INFORMED TO REPLACE RADIO. REPLACED ANDPROGRAMMED RA DIO. FOLLOWING SI INSTRUCTIONS, CHECKED FOR OTH UPDATES. NONE WERE AVA ILABLE. PERFORMED USB DOWNLOAD FOR FINAL RADIOPROGRAMMING. CLEARED CO DES AND TEST RADIO. CLAIM CODE FOR RADIO PROGRAM. ( ) CLAIM CODE FOR USB UPDATE. ( ) ",CUSTOMER STATES RADIO VOLUME CUTS OFF THE COMES BACK ON BY ITSELF LATE R.,2019-08-26T00:00:00.000Z,Spring Hill - Truck,Module/Component-No/Incorrect Communication,Audio/Entertainment/Navigation - Other issues,2019-12-19T00:00:00.000Z,NovaSprint,ElectroStreak,2020,SHT,,,,,,,LOSING COMMUNICATION CUSTOMER STATES RADIO VOLUME CUTS OFF THE COMES BACK ON BY ITSELF LATE R.,Radio
D-14589,3/31/2021,RADIO CRASHED DURING USB UPDATE,"VERIFIED DISPLAY SHOWS SIRIUS XM UPDATE SEE DEALER. DISPLAY ALSO SHOWS OVER-AIR UPDATE AVAILABLE. PROGRAMMED RADIO WITH NEW UPDATEWCC     PERFORMED RADIO USB UPDATE WCC  . RADIO CRASHED DUR ING USB UPDATE - ""UPDATE FAILED -SEE DEALER""INSTALLED AND SET UP SPEC IAL ORDER RADIO. RADIO NOW WORKING PROPERLY. OK TO RELEASE.",LOADING SIRIUS XM DISPLAYED ON SCREEN. WON'T GO AWAY. XM SAID THAT THE VEHICLE NEEDS TO COME IN FOR A RESET.,2019-08-07T00:00:00.000Z,Spring Hill - Truck,Module/Component-Shorted,Audio/Entertainment/Navigation - Communication,2019-10-21T00:00:00.000Z,NovaSprint,FusionNova,2020,SHT,,,,,,,RADIO CRASHED DURING USB UPDATE LOADING SIRIUS XM DISPLAYED ON SCREEN. WON'T GO AWAY. XM SAID THAT THE VEHICLE NEEDS TO COME IN FOR A RESET.,Radio
D-14697,11/19/2020,"PERFORMED RADIO USB AND SPS UPDATE OCTOBER  , RADIO SOFTWARE TODAY R EADS  - . . ....... CONTACT TAC, TECHNICIAN STATES TOREPLACE R ADIO","REPLACE RADIO, PROGRAM RADIO USB,  , SPS  , CLEA R DTCS, LET CUSTOMER TAKE AND TEST OPERATION, TAC CASE# - ","CUSTOMER STATES THE RADIO IS STILL HAVING ISSUES WITH LOADING CHANNELS AND PLAYING THE STATION, SCREEN WILL BE BLACK. CUSTOMER HASTO SELECT A FAVORITE AND THEN THE SCREEN WILL LOAD BACK UP. PLEASE INSPECT AND ADVISE",2019-08-11T00:00:00.000Z,Flint,Wiring/Electrical/Sensors-Shorted,Audio/Entertainment/Navigation - Audio,2019-10-15T00:00:00.000Z,NovaSprint,NebulaJet,2020,FLT,,,,,,,"PERFORMED RADIO USB AND SPS UPDATE OCTOBER  , RADIO SOFTWARE TODAY R EADS  - . . ....... CONTACT TAC, TECHNICIAN STATES TOREPLACE R ADIO CUSTOMER STATES THE RADIO IS STILL HAVING ISSUES WITH LOADING CHANNELS AND PLAYING THE STATION, SCREEN WILL BE BLACK. CUSTOMER HASTO SELECT A FAVORITE AND THEN THE SCREEN WILL LOAD BACK UP. PLEASE INSPECT AND ADVISE",Radio
D-14925,4/26/2021,INTERNAL FAILURE WITH THE RADIO,"COULD NOT DUPLICATE CONDITION WITH AUDIO MUTE, REFERENCE  -NA- . RADIO SOFTWARE VERSION   CURRENTLY INSTALLED. RADIO SHOWSOTA UPDATE FAILED. PREFORMED USB UPDATE AS OUTLINED IN  -NA- . UPDATE FAILED, ATTEMP TO RECOVER RADIO, RECOVERY FAILED. INTERNALRADIO FAULT. REPLACED THE RADIO, PERFORMED SPS AND USB PROGRAMMING NORMAL RADIO FUNCTION. RADIO PROGRAMMING   USB FILETRANSFER  ",CUSTOMER STATES THE RADIO WOULD NOT MUTE   TIMES,2019-08-19T00:00:00.000Z,Spring Hill - Truck,Module/Component-Shorted,Audio/Entertainment/Navigation - Audio,2019-08-20T00:00:00.000Z,NebulaCruiser,ThunderBlitz,2020,SHT,,,,,,,INTERNAL FAILURE WITH THE RADIO CUSTOMER STATES THE RADIO WOULD NOT MUTE   TIMES,Radio
D-15010,6/8/2020,test drove to verify complaint. volumn cuts off on am fm and xm stations. scanned for codes. no codes present. checked power andgrounds at radio. all power and grounds present. radio calibrated with latest softwear. internal fault with radio casuing loss ofvolumn.,replaced radio and programmed. vehicle operating to spec at this time,**********INSP customer states the radio is still going on and off. he is saying it happens when he is going over bumps.,2019-08-22T00:00:00.000Z,Spring Hill - Truck,Module/Component-No/Incorrect Communication,Audio/Entertainment/Navigation - Audio,2020-05-30T00:00:00.000Z,ThunderVolt,TurboFlare,2020,SHT,,,,,,,test drove to verify complaint. volumn cuts off on am fm and xm stations. scanned for codes. no codes present. checked power andgrounds at radio. all power and grounds present. radio calibrated with latest softwear. internal fault with radio casuing loss ofvolumn. **********INSP customer states the radio is still going on and off. he is saying it happens when he is going over bumps.,Radio
D-15143,12/21/2020,found radio display drops out and sound drops out intermittently and not always at the same time performed diag and verified radiosoftware version and all software up to date advised by tac to replace the radio tac case #,tech       labor op   replaced radio and programed and retested checked ok program code,C S C S RADIO DISPLAY BLANKS OUT BUT STILL HAS SO UND WHILE DRIVING CUTS ON AND OFF INTERMITTENTLY S OUND GOES IN AND OUT THENDISPLAY IS WORKING,2019-08-27T00:00:00.000Z,Fort Wayne,Module/Component-Shorted,Audio/Entertainment/Navigation - Audio,2019-11-06T00:00:00.000Z,ThunderVolt,TurboFlare,2020,FTW,,,,,,,found radio display drops out and sound drops out intermittently and not always at the same time performed diag and verified radiosoftware version and all software up to date advised by tac to replace the radio tac case # C S C S RADIO DISPLAY BLANKS OUT BUT STILL HAS SO UND WHILE DRIVING CUTS ON AND OFF INTERMITTENTLY S OUND GOES IN AND OUT THENDISPLAY IS WORKING,Radio
D-14651,7/16/2020,"INSPECT AND FOUND RADIO IS INOP. NO SOUND AND SCREEN IS INOP BUT CHEVROLET EMBLE LOADS UP ON SCREEN. SCANNED DTC GOT   LOSTCOMM WITH RADIO. PERFORMED AS OUTLINED IN SERVICE DIAG, GOT GOOD POWER AND GROUND. ALSO TESTED ETHERNET CIRCUIT FROM RADIO TOONSTAR MODULE WHICH SET DTC ALL CIRCUITS TESTED GOOD. NEED TO REPLACE RADIO","REPLACED RADIO ASSEMBLY AS PER GM SPECS. PROGRAMMED RADIO AND RETESTED, NOW RADIO IS WORKING AS INTENDED CODE  ",RADIO NOT WORKING,2019-08-09T00:00:00.000Z,Spring Hill - Truck,Other-Follow operation,Features/Controls/Displays - Other issues,2019-12-10T00:00:00.000Z,ThunderVolt,HyperFury X,2020,SHT,,,,,,,"INSPECT AND FOUND RADIO IS INOP. NO SOUND AND SCREEN IS INOP BUT CHEVROLET EMBLE LOADS UP ON SCREEN. SCANNED DTC GOT   LOSTCOMM WITH RADIO. PERFORMED AS OUTLINED IN SERVICE DIAG, GOT GOOD POWER AND GROUND. ALSO TESTED ETHERNET CIRCUIT FROM RADIO TOONSTAR MODULE WHICH SET DTC ALL CIRCUITS TESTED GOOD. NEED TO REPLACE RADIO RADIO NOT WORKING",Radio
D-14796,3/17/2021,INTERNAL FAULT IN RADIO RESET RADIO CONCERN STILL PRESENT USED DOCUMENT ID:   TO VERIFY POWER GROUND AND DATA ALL OK NO CODESPRESENT IN RADIO,DUPLICATED CONCERN AND DIAG REPLACED RADIO AND PROGRAM WITH SPS TIS   PROGRAM WITH USB TIS   RADIO IS NOW TURNING OFF,CUSTOMER STATES RADIO STAYS ON AFTER THE VEHICLE IS SHUT OFF AND THE DOORS ARE OPENED. CUSTOMER SETS ALARM AND IT STILL STAYS ON.TAKES ABOUT  + MIN FOR IT TO SHUT OFF ON ITS OWN. CHK AND ADVISE,2019-08-14T00:00:00.000Z,Lansing Delta,Module/Component-No/Incorrect Communication,Audio/Entertainment/Navigation - Audio,2019-10-12T00:00:00.000Z,ThunderVolt,HyperFury X,2020,DEL,,,,,,,INTERNAL FAULT IN RADIO RESET RADIO CONCERN STILL PRESENT USED DOCUMENT ID:   TO VERIFY POWER GROUND AND DATA ALL OK NO CODESPRESENT IN RADIO CUSTOMER STATES RADIO STAYS ON AFTER THE VEHICLE IS SHUT OFF AND THE DOORS ARE OPENED. CUSTOMER SETS ALARM AND IT STILL STAYS ON.TAKES ABOUT  + MIN FOR IT TO SHUT OFF ON ITS OWN. CHK AND ADVISE,Radio
D-14490,10/7/2020,INCORRECT COMMUNICATION,RAN DIAGNOSTIC FOUND RADIO HAS INCORRECT COMMUNICATION RADIO COMMUNICA TION FOR CADILLAC EMBLEM ON SCREEN - PERFORMED STANDARDPROGRAM AND ST ILL HAS CADILLAC SYMBOL AND FOREIGN LANGUAGE ON SCREEN CONTACTED TAN C ASE #  -  WAS ADVISED TO REPLACEDRADIO AND REPROGRAMMED AGAI N - INTERNAL FAULT VERIFIED ALL EMBLEM GM AND LANGUAGE IS CORRECT. WAR R CODE,CUSTOMER STATES THE CADILLAC SYMBOL POPS ON EVERY TIME THE VEHICLE IS STARTED,2019-08-02T00:00:00.000Z,Spring Hill - Truck,Wiring/Electrical/Sensors-No/Incorrect Communication,Audio/Entertainment/Navigation - Communication,2019-09-16T00:00:00.000Z,ThunderVolt,HyperFury X,2020,SHT,,,,,,,INCORRECT COMMUNICATION CUSTOMER STATES THE CADILLAC SYMBOL POPS ON EVERY TIME THE VEHICLE IS STARTED,Other
