Event id,Opened date,CAUSAL_VERBATIM,CORRECTION_VERBATIM,CUSTOMER_VERBATIM,BUILD_DATE,BUILD_PLANT_DESC,CAUSAL_CD_DESC,COMPLAINT_CD_DESC,IN_USE_DATE,MAKE,MODEL,MODLYR,PLANT,Trigger,Failure Component,Failure Condition,Additional Context,Fix Component,Fix Condition,Combined_Text,Extracted_Component
D-15286,8/17/2020,ck for codes     history in amplifier ck for bulletins found   na   states to ck updates was current at   also notedprograms were running slow at tilmes call tac case #    ed stated to return radio back to factory settings and letcustomer put their info back in if it is still not working right thay are to call in and we will order a radio gds radio #   upon trying to release car the radio reception would quit altogether at the same time the screen would go blank call tacback and order radio on this ro,reset radio to factory settings and road test radio still not operating correct order radio       replace ordered radio andprogram,customer states still having radio issues such as it just cuts out randomly and the screen stays black Check and advise,2019-08-31T00:00:00.000Z,Spring Hill - Truck,Module/Component-Shorted,Audio/Entertainment/Navigation - Audio,2019-12-30T00:00:00.000Z,NovaSprint,FusionNova,2020,SHT,,,,,,,ck for codes     history in amplifier ck for bulletins found   na   states to ck updates was current at   also notedprograms were running slow at tilmes call tac case #    ed stated to return radio back to factory settings and letcustomer put their info back in if it is still not working right thay are to call in and we will order a radio gds radio #   upon trying to release car the radio reception would quit altogether at the same time the screen would go blank call tacback and order radio on this ro customer states still having radio issues such as it just cuts out randomly and the screen stays black Check and advise,Radio
D-14603,5/19/2020,INTERNAL FAILURE OF RADIO CHASSIS CAUSING A LOSS OF COMMUNICATION WITH XM SERVICES,"TECHNICIAN INSPECTED VEHICLE NOTING THAT THERE ARE NO ACTIVE OR STORED CODES RELATED TO CUSTOMER CONCERN. AFTER MULTIPLE ATTEMPTSTO DUPLICA TE CUSTOMER CONCERN IT WAS FOUND THAT THE XM SIGNAL WOULD DISCONTINUE INTERMITTENTLY AFTER EXTENDED DRIVES. ALL RELATEDWIRES, CONNECTORS, A ND CIRCUITS WERE CHECKED WITH NO ISSUES BEING FOUND IT WAS CONFIRMED T HAT AN INTERNAL FAILURE OF THE RADIOCHASSIS WAS THE CAUSE. TECHNICIAN REMOVED AND REPLACED RADIO ASSEMBLY, AFTER INSTALLATION IT WAS PROGRA MMED, AND VERIFIEDOPERATIONAL TODAY. PROGRAMMING SPS #  ","OS THAT THE XM RADIO CUTS OUT AFTER A SHORT WHILE OF LISTENING TO SIXT IES ON  , BUT WHEN THEY CHANGE THE CHANNEL IT WORKS.",2019-08-07T00:00:00.000Z,Spring Hill - Truck,Module/Component-No/Incorrect Communication,Audio/Entertainment/Navigation - Communication,2019-09-18T00:00:00.000Z,NovaSprint,ElectroStreak,2020,SHT,,,,,,,"INTERNAL FAILURE OF RADIO CHASSIS CAUSING A LOSS OF COMMUNICATION WITH XM SERVICES OS THAT THE XM RADIO CUTS OUT AFTER A SHORT WHILE OF LISTENING TO SIXT IES ON  , BUT WHEN THEY CHANGE THE CHANNEL IT WORKS.",Radio
D-14623,5/13/2021,"Radio Failure-Upon inspection, found DTC  -Wireless LAN Antenna set as CURRENT DTC. Performed electrical diagnosis and foundall ok at this time. Upon further inspection, verified coax cable to pass component test. Found less than   OHM between the coaxcable outer shield end to end. Found infinite resistance between the coax cable center terminal and the coax cable outer shield.Tested   Wireless Communication Antenna WLAN with known good part. DTC stayed CURRENT","As per SI Document ID:  , replaced the   Radio. Performed Configure/Setup/Reprogram Radio with SPS, cleared codes, roadtest to verify repair complete. All ok at this time. Labor Op:   Labor Time:  .  WCC:  ",CUST STATES UNABLE TO DOWNLOAD UPDATES ON MEDIA SCREEN. PLEASE CHECK AND ADVISE,2019-08-08T00:00:00.000Z,Silao,Module/Component-Shorted,Audio/Entertainment/Navigation - Audio,2020-01-25T00:00:00.000Z,ThunderVolt,HyperFury X,2020,SIL,,,,,,,"Radio Failure-Upon inspection, found DTC  -Wireless LAN Antenna set as CURRENT DTC. Performed electrical diagnosis and foundall ok at this time. Upon further inspection, verified coax cable to pass component test. Found less than   OHM between the coaxcable outer shield end to end. Found infinite resistance between the coax cable center terminal and the coax cable outer shield.Tested   Wireless Communication Antenna WLAN with known good part. DTC stayed CURRENT CUST STATES UNABLE TO DOWNLOAD UPDATES ON MEDIA SCREEN. PLEASE CHECK AND ADVISE",Radio
D-14802,10/1/2020,,ce punch etait pour discuter probleme avec client pas aucun code j ai vf mise a jours et il y en a encore une en usb pour radioiot j ai charger clé usb code   et ca dit une demi heure pour reprogrammer ok fait vf aussi en sps systeme bloqué deja ajours code   lorsque j ai terminé toutes les lignes je suis allez dehors et appareillé mon android et lorsque passe desappel tout apparait a l ecran les seconde d appel s additionne mais aucune communication ne fonctionne et tout de suite appres monepouse m a r appeler pour voir ce qui ne vas pas radio probleme interne no     remplacer radio programer sps   et usp code   client doit faire son tset up,ADN - COMMUNICATION CSP que il n'est inccapable de faire aucun appel sortant depuis la mise à jour,2019-08-14T00:00:00.000Z,Fort Wayne,Module/Component-Registers Incorrectly,Audio/Entertainment/Navigation - Communication,2020-01-23T00:00:00.000Z,NovaSprint,AeroSpecter,2020,FTW,,,,,,, ADN - COMMUNICATION CSP que il n'est inccapable de faire aucun appel sortant depuis la mise à jour,Other
D-14749,10/19/2020,"MULTIPLE ISSUES WITH RADIO, HAD INTERNAL ANTENNA OPEN, NAV SD CARD WAS CORRUPTED, APPLE CARPLAY IN-OP AND USB SC CARD HUB NEEDSANEWGROUND","DIAG NO NAV, DTC  , ANTENNA OPEN. APPLEPLAY APP NOT SHOWING ON RADIO AND NAV KEPT SHOWING INACCURACY MESSAGE. REARHEADLINER,TOCK ANTENNA CABLE FROM ANTENNA TO RADIO, MEASURE OK, NO OPEN, CONTACT TECH ASSIST, THEY SAID TO MODIFIED GRD WIRE ORUSB/SD CARDHUBAS PER TSB  -NA- , DOC,  , R & R CENTER CONSOLE TO MODIFIED GRD, THEY SAID TO REPLACE RADIO, REPLACED RADIO,PROGRAMANDALSO DID THE USB FILE UPDATE, RE CK RADIO, STILL CAN'T READ SD CARD, APPLEPLAY IS WORKING, WIFI IS ALSO WORKING, BUTCAN'TREACHINTERNET, REPLACED SD CARD, RE CK, NAV OP, NAV IS WORKING NOW,",CUSTOMER STATES THE NAV SYSTEM READS ERROR,2019-08-13T00:00:00.000Z,Flint,Module/Component-Registers Incorrectly,Audio/Entertainment/Navigation - Navigation,2019-08-26T00:00:00.000Z,NovaSprint,FusionNova,2020,FLT,,,,,,,"MULTIPLE ISSUES WITH RADIO, HAD INTERNAL ANTENNA OPEN, NAV SD CARD WAS CORRUPTED, APPLE CARPLAY IN-OP AND USB SC CARD HUB NEEDSANEWGROUND CUSTOMER STATES THE NAV SYSTEM READS ERROR",Radio
D-15301,11/15/2019,"WHEN IN REVERSE RADIO DISPLAY GOES BLACK & HAS   ICONS (PHOTO ATTACHED). SCAN  - ,  - ,  -  (IN VIDEO PROCESSOR)& - ,  - ,  - , (IN RADIO) ALL ARE HISTORY. NEC TO CALL TAC TO FIND OUT WHAT THE ICONS STAND FOR. TAC STATED TOUSEEL-  TO TEST COAX CABLE FROM VIDEO PROCESSIONS MODULE TO RADIO ( .  OHMS) AND VIDEO PROCESSIONS MODULE TO REARVIEW CAMERA( . ) BOTH TEST GOOD. CALL TAC BACK STATED TO CHECK BUILD NUMBER FOR SOFTWARE. HAS CURRENT SOFTWARE. NEC. TO S/O RADIO./",INSTALL RADIO AND PROGRAM,CUSTOMER STATES WHEN PUTTING INTO REVERESE THERE IS NO BACK UP CAMERA-TWO ICONS SHOW UP ON THE DISPLAY STAYED THAT WAY AFTERPUTTINGINTO DRIVE UNTIL VEHICLE WAS PUT BACK INTO PARK AND BACK TO DRIVE SEE ATTACHED FOR ICONS--USUALLY HAPPENS IN THE AM,2019-09-02T00:00:00.000Z,Spring Hill - Truck,Module/Component-No/Incorrect Communication,Audio/Entertainment/Navigation - Audio,2019-12-02T00:00:00.000Z,ThunderVolt,WarpDriveX,2020,SHT,,,,,,,"WHEN IN REVERSE RADIO DISPLAY GOES BLACK & HAS   ICONS (PHOTO ATTACHED). SCAN  - ,  - ,  -  (IN VIDEO PROCESSOR)& - ,  - ,  - , (IN RADIO) ALL ARE HISTORY. NEC TO CALL TAC TO FIND OUT WHAT THE ICONS STAND FOR. TAC STATED TOUSEEL-  TO TEST COAX CABLE FROM VIDEO PROCESSIONS MODULE TO RADIO ( .  OHMS) AND VIDEO PROCESSIONS MODULE TO REARVIEW CAMERA( . ) BOTH TEST GOOD. CALL TAC BACK STATED TO CHECK BUILD NUMBER FOR SOFTWARE. HAS CURRENT SOFTWARE. NEC. TO S/O RADIO./ CUSTOMER STATES WHEN PUTTING INTO REVERESE THERE IS NO BACK UP CAMERA-TWO ICONS SHOW UP ON THE DISPLAY STAYED THAT WAY AFTERPUTTINGINTO DRIVE UNTIL VEHICLE WAS PUT BACK INTO PARK AND BACK TO DRIVE SEE ATTACHED FOR ICONS--USUALLY HAPPENS IN THE AM",Radio
D-15357,3/22/2021,CUSTOMER BROUGHT THE TRUCK IN LAST WEEK FOR PART OF THE RADIO SCREEN G OING BLACK SO I VERIFIED IT AND TEST IT CAME UP WITH IT JUSTNEEDED A NEW SCREEN. PUT A NEW SCREEN IN IT. CAME BACK THIS WEEK FOR THE SAME P ROBLEM. CALLED TAC AND THEY TOLD ME TO REPLACE THERADIO CONTROL MODUL E.,CUSTOMER BROUGHT THE TRUCK IN LAST WEEK FOR PART OF THE RADIO SCREEN G OING BLACK SO I VERIFIED IT AND TEST IT CAME UP WITH IT JUSTNEEDED A NEW SCREEN. PUT A NEW SCREEN IN IT. CAME BACK THIS WEEK FOR THE SAME P ROBLEM. CALLED TAC AND THEY TOLD ME TO REPLACE THERADIO CONTROL MODUL E. REPLACED THE RADIO CONTROL MODULE AND PROGRAMMED IT WITH SPS CODE I S  .,CUSTOMER STATES RADIO SCREEN WILL LOCK UP. ALSO THE PRESET CURSOR WILL DISAPPEAR. CHECK AND ADVISE,2019-09-05T00:00:00.000Z,Silao,Module/Component-No/Incorrect Communication,Audio/Entertainment/Navigation - Video,2019-11-20T00:00:00.000Z,ThunderVolt,ZenithCruiser,2020,SIL,,,,,,,CUSTOMER BROUGHT THE TRUCK IN LAST WEEK FOR PART OF THE RADIO SCREEN G OING BLACK SO I VERIFIED IT AND TEST IT CAME UP WITH IT JUSTNEEDED A NEW SCREEN. PUT A NEW SCREEN IN IT. CAME BACK THIS WEEK FOR THE SAME P ROBLEM. CALLED TAC AND THEY TOLD ME TO REPLACE THERADIO CONTROL MODUL E. CUSTOMER STATES RADIO SCREEN WILL LOCK UP. ALSO THE PRESET CURSOR WILL DISAPPEAR. CHECK AND ADVISE,Radio
D-14724,7/27/2020,"THE TECH SCANNED FOR CODES,  - , - ,  - ,  - ,  - ,  -  AND  -  SET. THE TECH FOUND  -NA-  STATES THE VEHICLE IS IN THE SUSPECT RANGE. THE TECH ATTEMPTED TO REPROGRAM AND ACTION BLOCKED DUE TO CURRENT SOFTWAREINSTALLED. THE TECH CONTACTED TAC CASE # -  AND PER TAC VIDEO PROCESSING MODULE WITH CURRENT CODE, NO COMMUNICATION TORADIO BUT NO CODES CURRENTLY SET IN RADIO. THE TECH STATES THE RADIO WILL NEED TO BE REPLACED.",REPLACED RADIO CLEARED CODES AND VERIFIED REPAIR WCC:,C/S IS GETTING A BLANK SCREEN WITH A LENS ICON WITH A SLASH THRU IT AND AND RED TRIANGLE ICON WHEN CAMERA SYSTEM IS TRYING TO BEUSED.CUSTOMER WILL GO IN THROUGH MENU AND SELECT CAMERA SYSTEM AND IT WILL WORK FOR A SECOND THEN NOT WORK.THIS SEEMS TO BEINTERMITENT,2019-08-12T00:00:00.000Z,Silao,Module/Component-Shorted,Audio/Entertainment/Navigation - Other issues,2019-08-30T00:00:00.000Z,NebulaCruiser,InfernoSprint,2020,SIL,,,,,,,"THE TECH SCANNED FOR CODES,  - , - ,  - ,  - ,  - ,  -  AND  -  SET. THE TECH FOUND  -NA-  STATES THE VEHICLE IS IN THE SUSPECT RANGE. THE TECH ATTEMPTED TO REPROGRAM AND ACTION BLOCKED DUE TO CURRENT SOFTWAREINSTALLED. THE TECH CONTACTED TAC CASE # -  AND PER TAC VIDEO PROCESSING MODULE WITH CURRENT CODE, NO COMMUNICATION TORADIO BUT NO CODES CURRENTLY SET IN RADIO. THE TECH STATES THE RADIO WILL NEED TO BE REPLACED. C/S IS GETTING A BLANK SCREEN WITH A LENS ICON WITH A SLASH THRU IT AND AND RED TRIANGLE ICON WHEN CAMERA SYSTEM IS TRYING TO BEUSED.CUSTOMER WILL GO IN THROUGH MENU AND SELECT CAMERA SYSTEM AND IT WILL WORK FOR A SECOND THEN NOT WORK.THIS SEEMS TO BEINTERMITENT",Radio
D-15139,6/10/2020,VERIFIED CUSTOMERS CONCERN PERFORMED SYSTEM DIAGNOSTICS SCANNED VEHICLE AND FOUND DTC   LOSS COMMUNICATION RADIO ON EITHER NETBUS.FOLLOWED DOCUMENT ID   FOR SYSTEM VERIFICATION AND CIRCUIT TESTING.TESTED EACH GROUND CIRCUITS AT RADIO AND ARE UNDER  .TESTED ALL B+ CIRCUITS AND ALL ARE WITHIN SPECS TEST LAMP ILLUMINATES AND FUSES ARE GOOD.TESTED LESS THAN  .V VOLTS AND EITHERNET CIRCUITS AND GROUND.TEST FOR INFINITE RESISTANCE AND GROUND.PER SI TO REPLACE RADIO MODULE,FOLLOWED SI FOR RADIO MODULE REMOVAL AND REPLACEMENT.PROGRAMMED USING SPS.SYSTEM IS NOW WORKING AS DESIGNED LABOR CODE:    .  HR Base LABOR TIME:  .,"CUSTOMER STATES RADIO SCREEN IS BLANK, NO AUDIO, WHEN PUT IN REVERSE BACK UP CAMERA DISPLAY COMES ON CHECK AND ADVISE",2019-08-26T00:00:00.000Z,Fort Wayne,Other-Campaign/ Tech Bulletin,Audio/Entertainment/Navigation - Audio,2020-09-06T00:00:00.000Z,TurboFlux,SolarStriker,2020,FTW,,,,,,,"VERIFIED CUSTOMERS CONCERN PERFORMED SYSTEM DIAGNOSTICS SCANNED VEHICLE AND FOUND DTC   LOSS COMMUNICATION RADIO ON EITHER NETBUS.FOLLOWED DOCUMENT ID   FOR SYSTEM VERIFICATION AND CIRCUIT TESTING.TESTED EACH GROUND CIRCUITS AT RADIO AND ARE UNDER  .TESTED ALL B+ CIRCUITS AND ALL ARE WITHIN SPECS TEST LAMP ILLUMINATES AND FUSES ARE GOOD.TESTED LESS THAN  .V VOLTS AND EITHERNET CIRCUITS AND GROUND.TEST FOR INFINITE RESISTANCE AND GROUND.PER SI TO REPLACE RADIO MODULE CUSTOMER STATES RADIO SCREEN IS BLANK, NO AUDIO, WHEN PUT IN REVERSE BACK UP CAMERA DISPLAY COMES ON CHECK AND ADVISE",Radio
D-15409,5/6/2021,Ordrer SD card receptical,"Remove and replace SD card receptical and reinstall SD card- message still reads sd card not working properly. Nextstepofrepairisto replace radio. Order radio. Remove and replace radio and program, WCC-  . CompleteUSBfiletransfer,WCC- . Check opertaion of nav system, Now working as intended.",Navigation will work short term after taking the SD card out and putting back in then there is an error Tech Cause Ordrer SD card receptical Tech Comments Remove and replace SD card receptical and reinstall SDcardmessagestillreadssd card not working properly Next step of repair is to replace radio Order radio Remove and   Complete USB file transfer WCC   Check opertaion of nav system Now working as intended,2019-09-06T00:00:00.000Z,Silao,Module/Component-Registers Incorrectly,Features/Controls/Displays - Other issues,2020-02-14T00:00:00.000Z,NovaSprint,FusionNova,2020,SIL,,,,,,,Ordrer SD card receptical Navigation will work short term after taking the SD card out and putting back in then there is an error Tech Cause Ordrer SD card receptical Tech Comments Remove and replace SD card receptical and reinstall SDcardmessagestillreadssd card not working properly Next step of repair is to replace radio Order radio Remove and   Complete USB file transfer WCC   Check opertaion of nav system Now working as intended,Radio
D-15223,4/26/2021,"CHECKED FOR TROUBLE CODES FOUND   STORED. WENT THROUGH BULLETIN AND ALSO WENT THROUGH THE CUSTOMER RECENT REPAIRS, CAMERAALREADY REPLACED AT ANOTHER DEALER. STARTED TAC CASE  - . OHMED COAX CABLE  .  GOOD, VOLTAGE COMING UT OF RADIO  .  ANDAT CAMERA  . . SINCE THE CAMERA HAS ALREADY BEEN REPLACED AND THE FIRMWARE/SOFTWARE IN THE RADIO ARE LATEST AND GREATEST THEYRECOMMENDED TO PERFORM WIGGLE TEST AT COAX CABLE CONNECTIONS AND SEE IF CONDITION WITH DUPLICATE WHICH IT DIDNT, ALSO THERESISTANCE DOES NOT FLUCTUATE SO IN THIS CASE THEY WOULD RECOMMEND RADIO REPLACEMENT AND HAVE CUSTOMER EVALUATE.",REPLACED RADIO AND PROGRAMMED WCC,"ELECT - CUSTOMER STATES REAR CAMERA IS INTERMITTENTLY INOP, OR THE SCREEN WILL HAVE A GLITCH.",2019-08-29T00:00:00.000Z,Spring Hill - Truck,Module/Component-Registers Incorrectly,Audio/Entertainment/Navigation - Video,2019-08-30T00:00:00.000Z,ThunderVolt,CelestialVortex,2020,SHT,,,,,,,"CHECKED FOR TROUBLE CODES FOUND   STORED. WENT THROUGH BULLETIN AND ALSO WENT THROUGH THE CUSTOMER RECENT REPAIRS, CAMERAALREADY REPLACED AT ANOTHER DEALER. STARTED TAC CASE  - . OHMED COAX CABLE  .  GOOD, VOLTAGE COMING UT OF RADIO  .  ANDAT CAMERA  . . SINCE THE CAMERA HAS ALREADY BEEN REPLACED AND THE FIRMWARE/SOFTWARE IN THE RADIO ARE LATEST AND GREATEST THEYRECOMMENDED TO PERFORM WIGGLE TEST AT COAX CABLE CONNECTIONS AND SEE IF CONDITION WITH DUPLICATE WHICH IT DIDNT, ALSO THERESISTANCE DOES NOT FLUCTUATE SO IN THIS CASE THEY WOULD RECOMMEND RADIO REPLACEMENT AND HAVE CUSTOMER EVALUATE. ELECT - CUSTOMER STATES REAR CAMERA IS INTERMITTENTLY INOP, OR THE SCREEN WILL HAVE A GLITCH.",Radio
D-15332,3/19/2020,"FOUND RADIO VOLUME CHANGES ON OWN AND CUTS OUT ON CERTAIN STATIONS. NO CODES SET IN ECM AND HAS ALL POWER AND GROUND TO RADIO,FOUND RADIO HAS UP TO DATE PROGRAM IN RADIO AND HMI MODULE. FOUND RADIO SENDS SIGNALS TO VOLUME CONTROL AND STATION CONTROL. RADIOMODULE HAS SHORT AND SENDING WRONG SIGNALS TO HMI AND RADIO CONTROLS.","REPLACED RADIO MODULE AND PROGRAMMED AND SETUP, TEST DROVE AND NOW NO VOLUME SPIKES AND NO SIGNAL ISSUES.","GUEST STATES THAT THE RADIO WILL STOP PLAYING SOUND WHEN VEHICLE IS FIRST STARTED, THE RADIO WILL BE ON, BUT THERE IS NO SOUND.ONLY HAPPENS ON THE SIRIUS XM STATIONS. THIS STARTED AFTER GUEST RENEWED SUBSCRIPTION WITH XM. IF GUEST CHANGES STATIONS IT WILLSTART WORKING AGAIN. SEE MATT FOR INFO",2019-09-04T00:00:00.000Z,Lansing Delta,Wiring/Electrical/Sensors-Shorted,Audio/Entertainment/Navigation - Audio,2019-10-25T00:00:00.000Z,ThunderVolt,TurboFlare,2020,DEL,,,,,,,"FOUND RADIO VOLUME CHANGES ON OWN AND CUTS OUT ON CERTAIN STATIONS. NO CODES SET IN ECM AND HAS ALL POWER AND GROUND TO RADIO,FOUND RADIO HAS UP TO DATE PROGRAM IN RADIO AND HMI MODULE. FOUND RADIO SENDS SIGNALS TO VOLUME CONTROL AND STATION CONTROL. RADIOMODULE HAS SHORT AND SENDING WRONG SIGNALS TO HMI AND RADIO CONTROLS. GUEST STATES THAT THE RADIO WILL STOP PLAYING SOUND WHEN VEHICLE IS FIRST STARTED, THE RADIO WILL BE ON, BUT THERE IS NO SOUND.ONLY HAPPENS ON THE SIRIUS XM STATIONS. THIS STARTED AFTER GUEST RENEWED SUBSCRIPTION WITH XM. IF GUEST CHANGES STATIONS IT WILLSTART WORKING AGAIN. SEE MATT FOR INFO",Radio
D-15275,9/23/2020,CONFIRMED CONCERN FOUND RADIO AND MULTIPLE SYSTEMS INOPERATIVE. SCANNE D VEHICLE AND FOUND THERE WAS NO COMMUNICATION WITH THERADIO. GAINED ACCESS TO THE RADIO AND TEST FOR BATTERY VOLTAGE AT   TERMINALS   AND  . FOUND GOOD AT  .  VOLTS. TEST FOR LESSTHAN   OHMS ON GROUND CIRC UITS   TERMIANLS   AND  . FOUND GOOD AT  .  OHMS. FOUND CONCERN IS CA USED BY A INTERNAL FAILURE OF THERADIO MODULE,DIAGNOSE ( . ) AND REPLACE RADIO ( . ),OWNER REPORTS SIRRIUS AND BOTH AM FM RADIO INOP PLUS CRUISE CONTROL IN OP AND CLOCK ON DASH DOES NOT SHOW CORRECT TIME PLUS HEADSUP DISPLAY IS INOP Speed limit did not display and at one time the radio did not come on. Restarted veh and all is working todayAlso a theft message d isplayed too,2019-08-30T00:00:00.000Z,Lansing Delta,Module/Component-Shorted,Audio/Entertainment/Navigation - Other issues,2020-07-25T00:00:00.000Z,NebulaCruiser,StellarGlide,2020,DEL,,,,,,,CONFIRMED CONCERN FOUND RADIO AND MULTIPLE SYSTEMS INOPERATIVE. SCANNE D VEHICLE AND FOUND THERE WAS NO COMMUNICATION WITH THERADIO. GAINED ACCESS TO THE RADIO AND TEST FOR BATTERY VOLTAGE AT   TERMINALS   AND  . FOUND GOOD AT  .  VOLTS. TEST FOR LESSTHAN   OHMS ON GROUND CIRC UITS   TERMIANLS   AND  . FOUND GOOD AT  .  OHMS. FOUND CONCERN IS CA USED BY A INTERNAL FAILURE OF THERADIO MODULE OWNER REPORTS SIRRIUS AND BOTH AM FM RADIO INOP PLUS CRUISE CONTROL IN OP AND CLOCK ON DASH DOES NOT SHOW CORRECT TIME PLUS HEADSUP DISPLAY IS INOP Speed limit did not display and at one time the radio did not come on. Restarted veh and all is working todayAlso a theft message d isplayed too,Radio
D-14664,10/1/2020,REAR VIEW CAMERA INOP SOP,Radio Replacement Base LABOR TIME     Time US Canada only You may claim up to the allowable laborhoursdepending on actual time to perform electricaldiagnosis ADD TIME         Install Software with USB           RAOADD TIME     warranty code   usb code   performed diagnosis rear view camera inop followed   for rear vision camera malfunction inspected for debris on camera none verified backup lamps workdisconnected   el   pinout tool to radio teswted for     between signal circuit radio ground was at   volts replaced radioandprogrammed also checked coax cable from radioto rear camera   ohms inner and outter shield had to remove rear door panel toaccessrear camera,C S REAR VIEW CAMERA INOP SOP,2019-08-09T00:00:00.000Z,Fort Wayne,Module/Component-Shorted,Audio/Entertainment/Navigation - Audio,2019-09-25T00:00:00.000Z,NebulaCruiser,StellarGlide,2020,FTW,,,,,,,REAR VIEW CAMERA INOP SOP C S REAR VIEW CAMERA INOP SOP,Camera
D-15420,5/30/2020,checked vehicle for updated and dtcs no dtcs found called tac case     Field Service engineer sent out Field serviceengineer advised to reset radio and have customer try radio without connecting any phone to vehicle also to remove emojis fromcontact list also called bac and advised to replace radio Customers concern was not duplicated replacing radio for customersatisfaction reached out to DMA AND FSE to confirm replacement,replaced radio working as intended after done and reprogramed claim code,customer states when vehicle is started will notice nav will search and not load then switches to phone Bluetooth and will noticeradio freezes then goes blank almost like radio is locked sometime will erase radio presets,2019-09-06T00:00:00.000Z,Silao,Wiring/Electrical/Sensors-No/Incorrect Communication,Audio/Entertainment/Navigation - Audio,2019-11-30T00:00:00.000Z,NovaSprint,AeroSpecter,2020,SIL,,,,,,,checked vehicle for updated and dtcs no dtcs found called tac case     Field Service engineer sent out Field serviceengineer advised to reset radio and have customer try radio without connecting any phone to vehicle also to remove emojis fromcontact list also called bac and advised to replace radio Customers concern was not duplicated replacing radio for customersatisfaction reached out to DMA AND FSE to confirm replacement customer states when vehicle is started will notice nav will search and not load then switches to phone Bluetooth and will noticeradio freezes then goes blank almost like radio is locked sometime will erase radio presets,Radio
D-15277,7/22/2020,"SCANNED FOR DTCS, FOUND DTC -   REMOVED PASSENGER SIDE INSTRUMENT PANEL LOWER TRIM PANEL INSULATOR, POWER SUPPLY CONVERTER,BRACKET, TO ACCESS RADIO RECEIVER. FOUND RADIO RECEIVER LOSING VOLTAGE INTERMITTENT WHEN WARM. NECESSARY TO REPLACE RADIO RECEIVER.","REPLACED RADIO RECEIVER, APPLIED DIELECTRIC GREASE TO CONNECTORS OF RECEIVER AND POWER SUPPLY CONVERTER, REINSTALLED POWER SUPPLYCONVERTER BRACKET AND MODULE. VERIFIED RADIO RECEIVER NOT GETTING AS WARM AND NO LONGER LOSING VOLTAGE. REINSTALLED PASSENGER SIDEINSTRUMENT PANEL LOWER TRIM PANEL INSULATOR, VERIFIED ON TEST DRIVE THAT RADIO NO LONGER TURNS OFF INTERMITTENT.",CUSTOMER STATES THE RADIO TURNS OFF BY ITSELF RANDOMLY WHILE DRIVING PLEASE CHECK AND ADVISE,2019-08-30T00:00:00.000Z,Flint,Module/Component-No/Incorrect Communication,Audio/Entertainment/Navigation - Other issues,2019-10-31T00:00:00.000Z,ThunderVolt,QuantumRider,2020,FLT,,,,,,,"SCANNED FOR DTCS, FOUND DTC -   REMOVED PASSENGER SIDE INSTRUMENT PANEL LOWER TRIM PANEL INSULATOR, POWER SUPPLY CONVERTER,BRACKET, TO ACCESS RADIO RECEIVER. FOUND RADIO RECEIVER LOSING VOLTAGE INTERMITTENT WHEN WARM. NECESSARY TO REPLACE RADIO RECEIVER. CUSTOMER STATES THE RADIO TURNS OFF BY ITSELF RANDOMLY WHILE DRIVING PLEASE CHECK AND ADVISE",Radio
D-14614,10/2/2020,"VERIFIED CUSTOMER CONCERN. INSPECTED NAV/MAP DISK - OK. RE-INSTALLED DISK AND PROBLEM STILL THERE. PERFORMED TSB # -NA- .REMOVED CENTER CONSOLE, CUT & RESTRUNG NEW GROUND WIRE TO   AND RECHECKED. PROBLEM STILL THERE. PER ERROR CODE DIAG IN SI,SWAPPED DISK WITH KNOWN GOOD DISK AND RETEST - PROBLEM STILL THERE. CHECKED SOFTWARE AND PERFORMED SOFTWARE UPDATE AND RETESTED -PROBLEM STILL THERE. RECOMMEN D REPLACE RADIO UNIT DUE TO INTERNAL FAILURE.",REPLACED RADIO CONTROL MODULE. PROGRAMMED WITH SPS PROGRAMMING AND WITH ISO USB PROGRAMMING. RECHECKED - MAP ERROR MESSAGE GONE ANDNAVIGATION WORKING AS DESIGNED. OK AT THIS TIME.,"CUSTOMER STATES THAT NAV UNIT IS DISPLAYING ""SD CARD IS REMOVED"" MESSAGE. CHECK & ADVISE.",2019-08-07T00:00:00.000Z,Silao,Module/Component-Shorted,Audio/Entertainment/Navigation - Video,2019-12-21T00:00:00.000Z,NebulaCruiser,StellarGlide,2020,SIL,,,,,,,"VERIFIED CUSTOMER CONCERN. INSPECTED NAV/MAP DISK - OK. RE-INSTALLED DISK AND PROBLEM STILL THERE. PERFORMED TSB # -NA- .REMOVED CENTER CONSOLE, CUT & RESTRUNG NEW GROUND WIRE TO   AND RECHECKED. PROBLEM STILL THERE. PER ERROR CODE DIAG IN SI,SWAPPED DISK WITH KNOWN GOOD DISK AND RETEST - PROBLEM STILL THERE. CHECKED SOFTWARE AND PERFORMED SOFTWARE UPDATE AND RETESTED -PROBLEM STILL THERE. RECOMMEN D REPLACE RADIO UNIT DUE TO INTERNAL FAILURE. CUSTOMER STATES THAT NAV UNIT IS DISPLAYING ""SD CARD IS REMOVED"" MESSAGE. CHECK & ADVISE.",Radio
D-15153,1/29/2020,CAMERA GOE SBLACK AND THERE IS A RED TRIANGLE AND NO CAMERA ICON,RADIO  /   .  DIAG.  -REAR CAMERA. PINPOINT TEST. AT TIMES WHEN THEVEHICLE IS IN REVERSE THE CAMERA GOES BLACK AND THERE IS A RED TRIANGLEAND NO CAMERA ICON. CONTACTED TAC. TAC CASE NUMBER- - .INSPECTED ORANGE CABLE AT THE RADIO. THE CABLE WAS PLUGGED IN. WHEN THECABLE WAS TOUCHED THE CAMERA WORKS. DOC ID- .   CONNECTOR AT  . UNPLUGGED ORANGE CABLE AT THE RADIO AND FOUND THAT THE BARRELCAME OUT OF THE RADIO WERE THE CABLE FITS. REPLACED AND PROGRAMMEDRADIO. SETUP AND CONFIGURED RADIO. WARRANTY CODE- .DIAG.- .  ADD- . ****************************************************,VEHICLE CAMERA DOES NOT ALWAYS WORK. GIVES ABLACK SCREEN WITH RED TRIANGLE,2019-08-27T00:00:00.000Z,Ramos Arizpe,Module/Component-Registers Incorrectly,Audio/Entertainment/Navigation - Audio,2019-10-05T00:00:00.000Z,ThunderVolt,HyperFury X,2020,RAM,,,,,,,CAMERA GOE SBLACK AND THERE IS A RED TRIANGLE AND NO CAMERA ICON VEHICLE CAMERA DOES NOT ALWAYS WORK. GIVES ABLACK SCREEN WITH RED TRIANGLE,Screen
