Event id,Opened date,CAUSAL_VERBATIM,CORRECTION_VERBATIM,CUSTOMER_VERBATIM,BUILD_DATE,BUILD_PLANT_DESC,CAUSAL_CD_DESC,COMPLAINT_CD_DESC,IN_USE_DATE,MAKE,MODEL,MODLYR,PLANT,Trigger,Failure Component,Failure Condition,Additional Context,Fix Component,Fix Condition,Combined_Text,Extracted_Component
D-15427,8/11/2020,DEFECT INSIDE RADIO ETHERNET CONNECTION INSIDE RADIO.PROGRAM CODE    ..USB..,SCANED CKED ETHERNET DOWN INSIDE RADIO. CONNECTION GOOD. REPLACED RADI O PROGRAMED. AND USB PROGRAMED. CKED NO CODE AFTER REPAIRS.,INSPECTIONS: DIAGNOSTICS// CUSTOMER STATES RADIO GOES BLANK . PREVIOUS DIAG DONE . SOP ARE HERE,2019-09-06T00:00:00.000Z,Silao,Module/Component-Shorted,Audio/Entertainment/Navigation - Video,2019-12-21T00:00:00.000Z,ThunderVolt,QuantumRider,2020,SIL,,,,,,,DEFECT INSIDE RADIO ETHERNET CONNECTION INSIDE RADIO.PROGRAM CODE    ..USB.. INSPECTIONS: DIAGNOSTICS// CUSTOMER STATES RADIO GOES BLANK . PREVIOUS DIAG DONE . SOP ARE HERE,Radio
D-15397,12/21/2020,DETERMINED ETHERNET FAULT WAS INTERNAL TO RADIO,SCANNED FOR CODES. RETRIEVED CODE   LOST COMMUNICATION WITH RADIO ON ETHERNET. USING DOCUMENT ID-   PERFORMEDDIAGNOSTICS. DETERMI NED ETHERNET FAULT WAS INTERNAL TO RADIO. REPLACED RADIO AND PROGRAMME D,CUSTOMER STATES RADIO WILL NOT COME ON- INTERMITTENT,2019-09-06T00:00:00.000Z,Silao,Module/Component-Shorted,Audio/Entertainment/Navigation - Audio,2020-05-09T00:00:00.000Z,ThunderVolt,TurboFlare,2020,SIL,,,,,,,DETERMINED ETHERNET FAULT WAS INTERNAL TO RADIO CUSTOMER STATES RADIO WILL NOT COME ON- INTERMITTENT,Radio
D-15385,12/14/2020,INTERNAL RADIO FAULT,"DIAGNOSED ON PREV RO, FOUND RADIO TO BE AT FAULT, REPLACE RADIO ASSEMB LY, PERFORM SPS PROGRAM TO SEAT UP ( )",ELECTRICAL; CUSTOMER REPORTING THAT THE BACK-UP CAMERA WILL SOMETIMES WORK AND SOMETIMES GOES TO BLANK SCREEN. TECH HAS ORDEREDPARTS THAT H AVE ARRIVED TO COMPLETE REPAIRS.,2019-09-05T00:00:00.000Z,Flint,Module/Component-Registers Incorrectly,Audio/Entertainment/Navigation - Audio,2020-03-31T00:00:00.000Z,NebulaCruiser,StellarGlide,2020,FLT,,,,,,,INTERNAL RADIO FAULT ELECTRICAL; CUSTOMER REPORTING THAT THE BACK-UP CAMERA WILL SOMETIMES WORK AND SOMETIMES GOES TO BLANK SCREEN. TECH HAS ORDEREDPARTS THAT H AVE ARRIVED TO COMPLETE REPAIRS.,Radio
D-15067,2/1/2020,"after repair was made, radio lost all functionality. hadno screen or audio. could not see or operate radio controls. found nocommunication to radio.",replaced and programmed radio. code: . USB:  . cleared all vehicle codes. radio andcontrols all operate correctly.,RADIO SCREEN WILL GO BLANKWHILE DRIVING,2019-08-23T00:00:00.000Z,Fort Wayne,Module/Component-No/Incorrect Communication,Audio/Entertainment/Navigation - Other issues,2020-05-06T00:00:00.000Z,NovaSprint,FusionNova,2020,FTW,,,,,,,"after repair was made, radio lost all functionality. hadno screen or audio. could not see or operate radio controls. found nocommunication to radio. RADIO SCREEN WILL GO BLANKWHILE DRIVING",Radio
D-15351,7/7/2020,"HISTORY    ,   PARTIALLY REMOVE RADIO TO ACCESS WIRING, CHECK AND LUBE COAX CABLE AT RADIO AND VIDEO PROCESSING MODULE, DIDNOT DUPLICATE CONCERN",CLEAN AND LUBE COAX CABLE CONNECTIONS AT RADIO AND VPM    .,NO DISPLAY WHEN GOING INTO REVERSE. ONLY ICON WITH BLOCKED OFF CAMERA COMES ON. CHECK AND ADVISE.,2019-09-04T00:00:00.000Z,Spring Hill - Truck,Wiring/Electrical/Sensors-Foreign Material,Audio/Entertainment/Navigation - Audio,2020-06-15T00:00:00.000Z,NebulaCruiser,StellarGlide,2020,SHT,,,,,,,"HISTORY    ,   PARTIALLY REMOVE RADIO TO ACCESS WIRING, CHECK AND LUBE COAX CABLE AT RADIO AND VIDEO PROCESSING MODULE, DIDNOT DUPLICATE CONCERN NO DISPLAY WHEN GOING INTO REVERSE. ONLY ICON WITH BLOCKED OFF CAMERA COMES ON. CHECK AND ADVISE.",Radio
D-15127,10/20/2020,INTERNAL RADIO FAULT,DIAGNOSED AND REPLACED RADIO,"CUSTOMER STATES AT TIMES, RADIO SCREEN WILL BLACK OUT WHEN DRIVING, SA YS AUDIO WILL CUT OFF INTERM, SAYS WILL INTERM COME BACK ONAFTER A MI NUTE OR TWO, OTHER TIMES WILL STAY BLACK UNTIL RESTART. SAYS SIRIUS AN D FM RECEPTION SEEMS TO BE VERY SPORATIC",2019-08-26T00:00:00.000Z,Spring Hill - Truck,Module/Component-No/Incorrect Communication,Audio/Entertainment/Navigation - Audio,2019-09-26T00:00:00.000Z,NovaSprint,ElectroStreak,2020,SHT,,,,,,,"INTERNAL RADIO FAULT CUSTOMER STATES AT TIMES, RADIO SCREEN WILL BLACK OUT WHEN DRIVING, SA YS AUDIO WILL CUT OFF INTERM, SAYS WILL INTERM COME BACK ONAFTER A MI NUTE OR TWO, OTHER TIMES WILL STAY BLACK UNTIL RESTART. SAYS SIRIUS AN D FM RECEPTION SEEMS TO BE VERY SPORATIC",Radio
D-14980,2/29/2020,"TECH FOUND VEHICLE SET DTC    , , , CONTACTED TAC AND STARTED CASE  - , TEHY HAD THE TECH TEST COAX AND TESTEDGOOD. THEY SUSPECTED CONNECTOR ON RADIO TO BE FAULTY",TECH REPLACED RADIO AND PROGRAMMED NOW WORKING AS DESIGNED,CUSTOMER STATES THAT THE BACK UP CAMERA IS NOT WORKING. PLEASE CHECK AND ADVISE.,2019-08-21T00:00:00.000Z,Flint,Wiring/Electrical/Sensors-Registers Incorrectly,Audio/Entertainment/Navigation - Video,2019-08-30T00:00:00.000Z,NovaSprint,FusionNova,2020,FLT,,,,,,,"TECH FOUND VEHICLE SET DTC    , , , CONTACTED TAC AND STARTED CASE  - , TEHY HAD THE TECH TEST COAX AND TESTEDGOOD. THEY SUSPECTED CONNECTOR ON RADIO TO BE FAULTY CUSTOMER STATES THAT THE BACK UP CAMERA IS NOT WORKING. PLEASE CHECK AND ADVISE.",Radio
D-14715,11/13/2019,"ATTEMPT TO RESTART SYSTEM WITH GLOBAL REBOOT-NO GO. SCAN FOR DTC -    . LOST COMMUNICATION WITH RADIO ON ETHERNET BUS.NODISPLAY, TRIED TO RESTARTAND FOLLOWED GLOBAL DIAGNOSTICS. CALLED TAC # - , WAS TOLD TO REPLACE RADIO","REPLACED RADIO AND PROGRAMMED PER TAC, RECHECKED-OK. WCC  ",RADIO DISPLAY IS BLACK,2019-08-12T00:00:00.000Z,Spring Hill - Truck,Module/Component-Shorted,Audio/Entertainment/Navigation - Audio,2019-11-13T00:00:00.000Z,ThunderVolt,HyperFury X,2020,SHT,,,,,,,"ATTEMPT TO RESTART SYSTEM WITH GLOBAL REBOOT-NO GO. SCAN FOR DTC -    . LOST COMMUNICATION WITH RADIO ON ETHERNET BUS.NODISPLAY, TRIED TO RESTARTAND FOLLOWED GLOBAL DIAGNOSTICS. CALLED TAC # - , WAS TOLD TO REPLACE RADIO RADIO DISPLAY IS BLACK",Radio
D-15358,2/22/2021,FOUND NO CODES STORED. FOUND BASED ON ERROR CODE RADIO DISPLAYED WHEN TRYING TO USE NAVIGATION. FOUND RECPTICLE IN CENTERCONSOLEFAULTY.,REPLACED RECEPTICLE. FOUND ERROR STILL OCCURING. FOUND FAULTY RADIO. R EPLACED RADIO. VERIFIED REPAIR,CUSTOMER STATES WHEN TRYING TO USE NAV WILL GET MSG SD NOT READ,2019-09-05T00:00:00.000Z,Silao,Module/Component-Broken,Audio/Entertainment/Navigation - Communication,2020-07-25T00:00:00.000Z,ThunderVolt,TurboFlare,2020,SIL,,,,,,,FOUND NO CODES STORED. FOUND BASED ON ERROR CODE RADIO DISPLAYED WHEN TRYING TO USE NAVIGATION. FOUND RECPTICLE IN CENTERCONSOLEFAULTY. CUSTOMER STATES WHEN TRYING TO USE NAV WILL GET MSG SD NOT READ,Radio
D-15080,3/13/2020,"checked all connections and service, ok. started a tac case, advised to replace radio case # - ",replaced radio and programmed,CUSTOMER STATES XM SIGNAL TOTALLY GOES OUT AND TO REGAIN THE SIGNAL CUSTOMER CALLS XM AND XM REFRESHES THE SIGNAL. THIS WORKS FOR AWEEK OR TWO AND THEN SIGNAL GOES OUT AGAIN,2019-08-23T00:00:00.000Z,Flint,Module/Component-No/Incorrect Communication,Audio/Entertainment/Navigation - Communication,2020-01-31T00:00:00.000Z,NovaSprint,AeroSpecter,2020,FLT,,,,,,,"checked all connections and service, ok. started a tac case, advised to replace radio case # -  CUSTOMER STATES XM SIGNAL TOTALLY GOES OUT AND TO REGAIN THE SIGNAL CUSTOMER CALLS XM AND XM REFRESHES THE SIGNAL. THIS WORKS FOR AWEEK OR TWO AND THEN SIGNAL GOES OUT AGAIN",Radio
D-14514,4/23/2020,COMMUNICATION,"  -- RUN DIAG, SCANNED SYSTEM, NO CODES PRESENT. CHECKED FOR BULLETI NS, NONE FOUND. CALL TECH ASSIST (CASE# - ), SENDOVER SCAN D ATA AND INFO. NEC TO SOP RADIO PER TECH ASSIST. NEC TO REPLACE RADIO P ER TAC, PROGRAM ( ) AND RETEST. ALLOK AT THIS TIME.",XMRADIO NO COMMUNICATIONS AGAIN,2019-08-05T00:00:00.000Z,Lansing Delta,Module/Component-No/Incorrect Communication,Audio/Entertainment/Navigation - Communication,2019-10-30T00:00:00.000Z,ThunderVolt,CelestialVortex,2020,DEL,,,,,,,COMMUNICATION XMRADIO NO COMMUNICATIONS AGAIN,Radio
D-15122,6/4/2020,software update,performed bulletin search scan tests reprogrammed radio with updated software w c c   installed new updated USBupdate w c c   took     hrs to download and install usb files DID NOT REPLACE RADIO REPROGRAMMED RADIO WITHSOFTWARE UPDATE,C S THE XM RADIO BACK UP SCREEN TWICE FREEZES UP,2019-08-26T00:00:00.000Z,Fort Wayne,,Audio/Entertainment/Navigation - Communication,2020-04-03T00:00:00.000Z,ThunderVolt,QuantumRider,2020,FTW,,,,,,,software update C S THE XM RADIO BACK UP SCREEN TWICE FREEZES UP,Radio
D-15146,10/2/2020,verified concern / scanned vehicle for codes - none / performed global reset / did not fix issue - requires radio,removed and replaced radio and programmed / tested / verified okProgram code:,check for radio screen switching on it's own and audio staying on after vehicle is off and doors are open,2019-08-27T00:00:00.000Z,Spring Hill - Truck,Module/Component-No/Incorrect Communication,Audio/Entertainment/Navigation - Other issues,2020-05-28T00:00:00.000Z,ThunderVolt,QuantumRider,2020,SHT,,,,,,,verified concern / scanned vehicle for codes - none / performed global reset / did not fix issue - requires radio check for radio screen switching on it's own and audio staying on after vehicle is off and doors are open,Radio
D-14786,6/25/2020,INTERNAL RADIO MALFUNCTION,REPLACED AND PROGRAMMED RADIO AND FOUND RADIO OPERATING PROPERLY AFTER REPAIRS OP CODE:,...SOP IS HERE...CUSTOMER STATES RADIO SCREEN GOES BLANK AND STILL PLAYS..DOESN'T BRING UP ALL CUSTOMER CONTACTS TOO...NAVIGATIONDOESN'T KNOW WHERE ADDRESS IS FOR STORES. OVER BUMPS,2019-08-14T00:00:00.000Z,Fort Wayne,Module/Component-Shorted,Audio/Entertainment/Navigation - Audio,2020-03-20T00:00:00.000Z,ThunderVolt,TurboFlare,2020,FTW,,,,,,,INTERNAL RADIO MALFUNCTION ...SOP IS HERE...CUSTOMER STATES RADIO SCREEN GOES BLANK AND STILL PLAYS..DOESN'T BRING UP ALL CUSTOMER CONTACTS TOO...NAVIGATIONDOESN'T KNOW WHERE ADDRESS IS FOR STORES. OVER BUMPS,Radio
D-15362,1/23/2020,TECH #  check concern gds codes     codes wont clear try module lockup and pull fuse check pwrgds phone taccase#  order radio,TECH #  radio and programmed- --radio works as it should,Driver of unit state Update Failed See Dealer is illuminated on the Entertainment Center Please repair as needed,2019-09-05T00:00:00.000Z,Fort Wayne,Module/Component-No/Incorrect Communication,Audio/Entertainment/Navigation - Other issues,2019-09-30T00:00:00.000Z,ThunderVolt,QuantumRider,2020,FTW,,,,,,,TECH #  check concern gds codes     codes wont clear try module lockup and pull fuse check pwrgds phone taccase#  order radio Driver of unit state Update Failed See Dealer is illuminated on the Entertainment Center Please repair as needed,Radio
D-15329,6/10/2020,REMOVE AND REPLACE   RADIO MODULE PER TAC CASE,REPROGRAM REPLACE AND SET UP NEW RADIO USB PROG   MODULE PROGRAMMING,RADIO NAVIGATION WILL NOT SEARCH FOR NON PROGRAMMED DESTINATIONS.. - SHUTS DOWN & RESTARTS - CHECK FOR BULLETINS/UPDATES SDCARDISNEW - HAS NOTIFICATION ON SCREEN THAT SAYS SD CARD,2019-09-04T00:00:00.000Z,Fort Wayne,Module/Component-Registers Incorrectly,Audio/Entertainment/Navigation - Audio,2020-01-23T00:00:00.000Z,ThunderVolt,TurboFlare,2020,FTW,,,,,,,REMOVE AND REPLACE   RADIO MODULE PER TAC CASE RADIO NAVIGATION WILL NOT SEARCH FOR NON PROGRAMMED DESTINATIONS.. - SHUTS DOWN & RESTARTS - CHECK FOR BULLETINS/UPDATES SDCARDISNEW - HAS NOTIFICATION ON SCREEN THAT SAYS SD CARD,Radio
D-15229,4/1/2020,INTERNAL FAILURE,"PROGRAMMED RADIO, PROGRAMMING FAILED, REPLACED AND PROGRAMMED RADIO. A LL SYSTEMS OPERATING AS DESIGNED AT THIS TIME",CUSTOMER STATES WHEN GOING TO REMOTE START THE VEHICEL THE RADIO RISPL AY STAYS OFF. AS OF RECENT ALL SOUND IS CUT OFF . ONLYHAPPENS WHEN GO ING TO REMOTE START.,2019-08-29T00:00:00.000Z,Silao,Module/Component-No/Incorrect Communication,Audio/Entertainment/Navigation - Audio,2019-12-01T00:00:00.000Z,ThunderVolt,QuantumRider,2020,SIL,,,,,,,INTERNAL FAILURE CUSTOMER STATES WHEN GOING TO REMOTE START THE VEHICEL THE RADIO RISPL AY STAYS OFF. AS OF RECENT ALL SOUND IS CUT OFF . ONLYHAPPENS WHEN GO ING TO REMOTE START.,Radio
D-14976,3/15/2021,INCORRECT COMMUNICATION,CHECK. NO CODES. CHECK RADIO CONTROLS NEEDS CONTROL ASSEMBLY PARTS ON ORDER REPLACE RADIO DISPLAY UNIT. TEST. OK,CUSTOMER REPORTS THE BACK-LIGHTING FOR THE KEYS / BUTTONS BENEATH INFO TAINMENT SCREEN DO NOT LIGHT UP. SKIP FORWARD AND OTHERSLOOK DIM - IN SPECT AND REPORT,2019-08-21T00:00:00.000Z,Flint,Module/Component-No/Incorrect Communication,Audio/Entertainment/Navigation - Video,2019-10-15T00:00:00.000Z,ThunderVolt,TurboFlare,2020,FLT,,,,,,,INCORRECT COMMUNICATION CUSTOMER REPORTS THE BACK-LIGHTING FOR THE KEYS / BUTTONS BENEATH INFO TAINMENT SCREEN DO NOT LIGHT UP. SKIP FORWARD AND OTHERSLOOK DIM - IN SPECT AND REPORT,Screen
D-14584,12/11/2020,NO DTCs. RADIO SOFTWARE UP TO DATE. SUSPECT INTERNAL RADIO FAILURE.,REPLACED RADIO AND PROGRAMMED.,RADIO DOES NOT LOAD WHEN STARTING VEHICLE. HEARS CLICK NOISE UNDER DASH-DRIVER SIDE.STATES SEARCHING FOR SIGNAL.WHEN USING FM/XMRADIO. BLUETOOTH WILL NOT WORK AT ALL. SOP ORDERED AND IN STK TECH,2019-08-07T00:00:00.000Z,Fort Wayne,Module/Component-No/Incorrect Communication,Audio/Entertainment/Navigation - Communication,2019-08-23T00:00:00.000Z,ThunderVolt,OrionScout,2020,FTW,,,,,,,NO DTCs. RADIO SOFTWARE UP TO DATE. SUSPECT INTERNAL RADIO FAILURE. RADIO DOES NOT LOAD WHEN STARTING VEHICLE. HEARS CLICK NOISE UNDER DASH-DRIVER SIDE.STATES SEARCHING FOR SIGNAL.WHEN USING FM/XMRADIO. BLUETOOTH WILL NOT WORK AT ALL. SOP ORDERED AND IN STK TECH,Radio
D-15021,5/21/2020,VERIFIED CONCERN FOUND RADIO INTERNALLY LOGIC LOCKING INTERMITTENTLY A ND RESETTING.,PROGRAMMING CODE   -  . REPLACED RADIO ASSEMBLY. ADD .  TO PROGRAM RADIO  .,"CUSTOMER STATES DRIVERS INFORTAINMENT SCREEN GOES BLANK AND TURNS OFF AND ON ON ITS OWN AND NO AUDIO SOUND WHEN OFF , INTERMITTENTLY",2019-08-22T00:00:00.000Z,Silao,Module/Component-Registers Incorrectly,Audio/Entertainment/Navigation - Other issues,2019-11-19T00:00:00.000Z,NovaSprint,FusionNova,2020,SIL,,,,,,,"VERIFIED CONCERN FOUND RADIO INTERNALLY LOGIC LOCKING INTERMITTENTLY A ND RESETTING. CUSTOMER STATES DRIVERS INFORTAINMENT SCREEN GOES BLANK AND TURNS OFF AND ON ON ITS OWN AND NO AUDIO SOUND WHEN OFF , INTERMITTENTLY",Radio
D-14985,9/1/2020,"Diagnose radio, no communication. Verify powers and grounds. Found an internal failure.",Replace radio. SPS program ( ). USB program ( ).,CUSTOMER STATES RADIO DISPLAY IS BLACK AND WILL NOT TURN ON WITH NO SOUND COMING FROM SPEAKERS. CUSTOMER STATES BACK UP CAMERASTILL WORKS. CHECK AND ADVISE.,2019-08-21T00:00:00.000Z,Spring Hill - Truck,Module/Component-No/Incorrect Communication,Audio/Entertainment/Navigation - Communication,2019-08-22T00:00:00.000Z,ThunderVolt,HyperFury X,2020,SHT,,,,,,,"Diagnose radio, no communication. Verify powers and grounds. Found an internal failure. CUSTOMER STATES RADIO DISPLAY IS BLACK AND WILL NOT TURN ON WITH NO SOUND COMING FROM SPEAKERS. CUSTOMER STATES BACK UP CAMERASTILL WORKS. CHECK AND ADVISE.",Radio
D-14867,8/14/2020,DTC     INCORRECT COMPONENT INSTALLED. REPL REAR VIEW CAMERA; STILL INOP. FOUND A   STORED IN RADIO. ATTEMPT TO REPROGRAM;CODE RETURNED.,REMV/REPL RADIO AND PROGRAMMED W/ LATEST SOFTWARE. REINSTALLED NEW CAMERA AND TESTED W/ CONCERN. WORKS AS DESIGNED.,RERA CAMERA GOES BLANK WHEN HOT OUTSIDE,2019-08-16T00:00:00.000Z,Fort Wayne,Module/Component-No/Incorrect Communication,Features/Controls/Displays - Other issues,2019-08-17T00:00:00.000Z,NebulaCruiser,ThunderBlitz,2020,FTW,,,,,,,DTC     INCORRECT COMPONENT INSTALLED. REPL REAR VIEW CAMERA; STILL INOP. FOUND A   STORED IN RADIO. ATTEMPT TO REPROGRAM;CODE RETURNED. RERA CAMERA GOES BLANK WHEN HOT OUTSIDE,Radio
D-15284,9/15/2020,"verified customer complaint, tested all wiring to radio, videotaped concern, contacted tac, case is attached. advised to replaceradio and re test",replaced radio per tac and re tested,CUSTOMER STATES MEDIA SCREEN GOES BLANK SEE HISTORY UPDATE HAS BEEN PERFORMED TWICE CUST SENT ADVISER VIDEO,2019-08-30T00:00:00.000Z,Fort Wayne,Module/Component-No/Incorrect Communication,Audio/Entertainment/Navigation - Other issues,2019-12-19T00:00:00.000Z,TurboFlux,SolarStriker,2020,FTW,,,,,,,"verified customer complaint, tested all wiring to radio, videotaped concern, contacted tac, case is attached. advised to replaceradio and re test CUSTOMER STATES MEDIA SCREEN GOES BLANK SEE HISTORY UPDATE HAS BEEN PERFORMED TWICE CUST SENT ADVISER VIDEO",Radio
D-14851,3/12/2020,internal fault to radio,diag previous visit with TAC advisement to replace radio for turn by turn navigation inop replace IOS radio configure and programwith sps wcc#   test vehicle turn by turn guidance ok,owner states check turn by turn not operating correctly sop part is here to correct,2019-08-15T00:00:00.000Z,Flint,Module/Component-No/Incorrect Communication,Audio/Entertainment/Navigation - Navigation,2019-12-21T00:00:00.000Z,TurboFlux,SolarStriker,2020,FLT,,,,,,,internal fault to radio owner states check turn by turn not operating correctly sop part is here to correct,Radio
D-14907,3/15/2021,found radio module communicating with video control module check associated circuits all ok replaced radio module restoredcommunication rear camera display missing,replaced radio module and verified reapir gained module communacation missing camera input,CUSTOMER STATES BACKUP CAMERA INOP,2019-08-19T00:00:00.000Z,Spring Hill - Truck,Module/Component-Broken,Audio/Entertainment/Navigation - Communication,2020-06-22T00:00:00.000Z,ThunderVolt,TurboFlare,2020,SHT,,,,,,,found radio module communicating with video control module check associated circuits all ok replaced radio module restoredcommunication rear camera display missing CUSTOMER STATES BACKUP CAMERA INOP,Radio
D-15233,5/17/2021,CURRENT. RADIO MODULE LOSING COMMUNICATION. INFOTAINMENT CENTER DISPLAYS PROGRAMMING FAILED. ATTEMPTED TO REPROGRAM MODULE.MODULE UNABLE TO COMMUNICATE ON SPS. DIAG LEAD TO REPLACING RADIO MODULE,"REPLACED RADIO MODULE, PROGRAMMED MODULE AND VERIFIED REPAIR",RADIO SCREEN SAYS UPDATE FAILED,2019-08-29T00:00:00.000Z,Flint,Module/Component-No/Incorrect Communication,Audio/Entertainment/Navigation - Communication,2019-10-02T00:00:00.000Z,NovaSprint,FusionNova,2020,FLT,,,,,,,CURRENT. RADIO MODULE LOSING COMMUNICATION. INFOTAINMENT CENTER DISPLAYS PROGRAMMING FAILED. ATTEMPTED TO REPROGRAM MODULE.MODULE UNABLE TO COMMUNICATE ON SPS. DIAG LEAD TO REPLACING RADIO MODULE RADIO SCREEN SAYS UPDATE FAILED,Radio
D-14954,4/8/2021,"""UNABLE TO UPDATE"" MESSAGE ON RADIO, UDATES FAILED REQ NEW RADIO.","CC- , REPLACE AND PROGRAM RADIO AS PREVIOUSLY DIAGNOSED, WCC-   , CLEAR CODES,   PAY  .  HRS,",CUSTOMER REPORTS THE RADIO WILL STA Y ON FOR   MINS AFTER THE VEHCLE SHUT OFF AND DOORS OPENED. RADIO ORDERED PREV RO  / /  TECH,2019-08-20T00:00:00.000Z,Spring Hill - Truck,Module/Component-Registers Incorrectly,Audio/Entertainment/Navigation - Audio,2020-01-30T00:00:00.000Z,ThunderVolt,HyperFury X,2020,SHT,,,,,,,"""UNABLE TO UPDATE"" MESSAGE ON RADIO, UDATES FAILED REQ NEW RADIO. CUSTOMER REPORTS THE RADIO WILL STA Y ON FOR   MINS AFTER THE VEHCLE SHUT OFF AND DOORS OPENED. RADIO ORDERED PREV RO  / /  TECH",Radio
D-14916,4/9/2021,the radio module is faulty,attempted to reprogram the radio per usb file transfer but it failed last update checked screen displayed       beforetryingto update radio and after it displayed       replaced the radio and programmed it warranty claim code     add,CUSTOMER STATES TURNER INOP,2019-08-19T00:00:00.000Z,Flint,Module/Component-Shorted,Audio/Entertainment/Navigation - Audio,2020-03-18T00:00:00.000Z,NovaSprint,GalacticRoamer,2020,FLT,,,,,,,the radio module is faulty CUSTOMER STATES TURNER INOP,Radio
D-15319,1/8/2021,"verified blue tooth droping out, verified all calibrations are up to date, requires new radio,","removed and installed new   radio module, programmed module Warranty Claim Code:  , completed USB file transferWarranty Claim Code:  ",BLUETOOTH IS DROPPING/ NOT DETECTING PHONE/ HAS HAD UPDATE,2019-09-03T00:00:00.000Z,Lansing Delta,Module/Component-No/Incorrect Communication,Audio/Entertainment/Navigation - Other issues,2019-12-02T00:00:00.000Z,NovaSprint,NebulaJet,2020,DEL,,,,,,,"verified blue tooth droping out, verified all calibrations are up to date, requires new radio, BLUETOOTH IS DROPPING/ NOT DETECTING PHONE/ HAS HAD UPDATE",Radio
D-14610,6/25/2020,FOUDN RADIO NOT SENDING INPUT TO THE SCREEN CAUSING THE BLANK SCREEN CHECKED ALL CIRCUITS AND CABLES ALL TESTED GOOD,REPLACED RADIO AND PROGRAMMED USB AND SPS,GUEST STATES INTERMITTENTLY WHILE DRIVING THE RADIO SCREEN WILL GO BLACK THE MUSIC WILL STILL PLAY IT WILL COME BACK ON ITS OWN,2019-08-07T00:00:00.000Z,Spring Hill - Truck,Module/Component-Shorted,Audio/Entertainment/Navigation - Video,2019-08-28T00:00:00.000Z,NovaSprint,AeroSpecter,2020,SHT,,,,,,,FOUDN RADIO NOT SENDING INPUT TO THE SCREEN CAUSING THE BLANK SCREEN CHECKED ALL CIRCUITS AND CABLES ALL TESTED GOOD GUEST STATES INTERMITTENTLY WHILE DRIVING THE RADIO SCREEN WILL GO BLACK THE MUSIC WILL STILL PLAY IT WILL COME BACK ON ITS OWN,Radio
D-14972,1/4/2021,FLOWING DOC ID  . REPLACED SD CARD READER. STILL MEASSGE IS DISPLAYED SD CARD HAS BEEN REMOVED. CHECKED THE FOWARD USB PORTAND NO CHANGE. RADIO IS TH NEXT THIMG TO REPLACE.,REPLACED RADIO AND PROGRAMED. NAV IS NOW WORKING PROGRAMED CODE,CUSTOMER STATES THAT THE NAVIGATION ISN'T WORKING,2019-08-20T00:00:00.000Z,Lansing Delta,Module/Component-No/Incorrect Communication,Audio/Entertainment/Navigation - Navigation,2019-11-15T00:00:00.000Z,NovaSprint,NebulaJet,2020,DEL,,,,,,,FLOWING DOC ID  . REPLACED SD CARD READER. STILL MEASSGE IS DISPLAYED SD CARD HAS BEEN REMOVED. CHECKED THE FOWARD USB PORTAND NO CHANGE. RADIO IS TH NEXT THIMG TO REPLACE. CUSTOMER STATES THAT THE NAVIGATION ISN'T WORKING,Radio
D-15333,6/30/2020,CALLED GM TECH ASSISTANCE CASE #  -  AND WAS ADVISED TO REPLACE THE RADIO FOR CUSTOMER SATISFACTION.,REPLACED RADIO ASSEMBLY. PROGRAMMED AND SETUP. CLAIM CODE,C/S AT TIMES THE TRUCK WILL NOT RECOGNIZE THE CONTACTS SAVED IN THE PHONE LIST. IT HAPPENS TO DIFFERENT CONTACTS IN THE PHONE,2019-09-04T00:00:00.000Z,Lansing Delta,Module/Component-No/Incorrect Communication,Audio/Entertainment/Navigation - Communication,2019-10-30T00:00:00.000Z,ThunderVolt,TurboFlare,2020,DEL,,,,,,,CALLED GM TECH ASSISTANCE CASE #  -  AND WAS ADVISED TO REPLACE THE RADIO FOR CUSTOMER SATISFACTION. C/S AT TIMES THE TRUCK WILL NOT RECOGNIZE THE CONTACTS SAVED IN THE PHONE LIST. IT HAPPENS TO DIFFERENT CONTACTS IN THE PHONE,Radio
D-14621,4/23/2020,.  ADD  .  DIAGNOSIS - CONFIRMED RADIO CUTTING OUT - TESTED POWER AND GROUND - CHECKED FOR UPDATES - INTERNAL F,AULT WITH RADIO - REPLACED AND PROGRAMMED - TESTED OPERATION,RADIO CUTS OUT WHEN DRIVING - WHEN SWITCHING STATIONS WILL NOT PLAY - SCREEN STILL STAYS LIT - DIAG AND ADVISE,2019-08-08T00:00:00.000Z,Lansing Delta,Module/Component-Registers Incorrectly,Audio/Entertainment/Navigation - Audio,2019-09-27T00:00:00.000Z,ThunderVolt,QuantumRider,2020,DEL,,,,,,,.  ADD  .  DIAGNOSIS - CONFIRMED RADIO CUTTING OUT - TESTED POWER AND GROUND - CHECKED FOR UPDATES - INTERNAL F RADIO CUTS OUT WHEN DRIVING - WHEN SWITCHING STATIONS WILL NOT PLAY - SCREEN STILL STAYS LIT - DIAG AND ADVISE,Radio
D-14587,3/18/2021,"Scanned for DTCs, Telematics control module, IPC, and amplifier all have DTC     - lost communication with radio on ethernetbus. Tested Ethernet ckts at radio, found radio is faulty.",replaced radio.Programmed new radio. warranty claim code -  .,"Loss of sound, no radio or cell phone.",2019-08-07T00:00:00.000Z,Fairfax II,Module/Component-Registers Incorrectly,Audio/Entertainment/Navigation - Other issues,2019-11-29T00:00:00.000Z,ThunderVolt,ShadowPulse,2020,FAI,,,,,,,"Scanned for DTCs, Telematics control module, IPC, and amplifier all have DTC     - lost communication with radio on ethernetbus. Tested Ethernet ckts at radio, found radio is faulty. Loss of sound, no radio or cell phone.",Radio
D-14959,2/27/2020,TAC CASE #  -  (JEREMY) REPLACE   RADIO MODULE,diagnose for blank screen. test circuit and confirm normal. as per engineering need to replace radio. replace radio. program claimcode  . op code   diag  . . +  . .,CONCERN: RADIO SCREEN WILL NOT WORK AT ALL - TOUCH SCREEN DOES NOT WORK,2019-08-20T00:00:00.000Z,Lansing Delta,Module/Component-Incorrect Version,Audio/Entertainment/Navigation - Audio,2020-01-03T00:00:00.000Z,NovaSprint,AeroSpecter,2020,DEL,,,,,,,TAC CASE #  -  (JEREMY) REPLACE   RADIO MODULE CONCERN: RADIO SCREEN WILL NOT WORK AT ALL - TOUCH SCREEN DOES NOT WORK,Radio
D-14939,7/15/2020,RADIO CONTROL INTERNAL SHORT,INSPECTED AND FOUND RADIO CONTROL NOT REACTING TO DEMANDS. TESTED ALL POWERS AND GROUNDS TO CONTROL ALL OK. DIAGNOSED AND REPLACEDRADIO CON TROL AND TESTED ALL OK,CLIENT STATES REPLACE RADIO PER PREVIOUS DIAGNOSIS TO RECTIFY RADIO DI SPLAY SCREEN FREEZES,2019-08-20T00:00:00.000Z,Silao,Module/Component-Shorted,Features/Controls/Displays - Other issues,2020-05-11T00:00:00.000Z,ThunderVolt,TurboFlare,2020,SIL,,,,,,,RADIO CONTROL INTERNAL SHORT CLIENT STATES REPLACE RADIO PER PREVIOUS DIAGNOSIS TO RECTIFY RADIO DI SPLAY SCREEN FREEZES,Radio
